{
  "id": 10,
  "callLetters": "KBOI",
  "frequency": "93.1 FM/670 AM",
  "location": "Boise, Idaho",
  "format": "News/Talk",
  "stationName": "KBOI \"Idaho's News Talk Authority\"",
  "established": "1947",
  "synopsis": "KBOI stands as one of Idaho's most influential and longest-running broadcast institutions, serving the Treasure Valley for nearly eight decades as both a radio and television pioneer.",
  "fullContent": "KBOI 93.1 FM/670 AM: Idaho's News Talk Authority - Comprehensive Station Report\n\nIntroduction\n\nKBOI stands as one of Idaho's most influential and longest-running broadcast institutions, serving the Treasure Valley for nearly eight decades as both a radio and television pioneer. From its origins as KDSH in 1947 with a full-service format featuring news, music, radio dramas, and community programming, KBOI has evolved into \"Idaho's News Talk Authority,\" establishing itself as the region's premier destination for news, talk, and political discourse. The station's remarkable journey spans the golden age of radio through the digital revolution, maintaining relevance and influence through multiple ownership changes, format evolutions, and technological transitions. Under current Cumulus Media ownership, KBOI operates as a dual-frequency powerhouse broadcasting on both 670 AM\u2014one of the most powerful signals in the region\u2014and 93.1 FM, providing comprehensive coverage across Idaho and beyond. With veteran personalities like Mike Kasper, Chris Walton, and Nate Shelman, plus its role as the flagship station for Boise State University athletics, KBOI represents the gold standard for local news/talk radio. The station's commitment to live, local programming and community engagement demonstrates how traditional broadcasting can thrive in the modern media landscape while maintaining editorial independence and serving the public interest.\n\nOrigins as KDSH and Early Broadcasting History\n\nKBOI's broadcasting legacy began in 1947 when the station \"first signed on the air with call letters KDSH.\" The original programming reflected radio's golden age diversity, featuring \"what's known as a full-service format \u2013 consisting of news, music, radio dramas, and other programming.\" This comprehensive approach served a post-war audience hungry for entertainment, information, and community connection.\n\nThe KDSH era represented typical small-market radio of the late 1940s, when stations served as community focal points providing entertainment, local news, weather, agricultural reports, and emergency information. The full-service format required significant local programming capability and reflected the station's commitment to serving diverse audience needs throughout the broadcast day.\n\nDuring the early years, the station established the foundation for what would become its long-term commitment to news and community service. The emphasis on local programming and community involvement created audience loyalty that would prove essential for navigating the competitive changes ahead in the broadcasting industry.\n\nThe 1950s brought the most significant development in the station's early history when it \"later expanded to TV, launching channel 2, and in the 1950s became KBOI.\" This expansion into television demonstrated the ownership's recognition of emerging media trends and willingness to invest in new technologies.\n\nTelevision Partnership and KBOI Identity\n\nThe launch of KBOI-TV Channel 2 represented a major expansion that positioned the operation as a true multimedia enterprise. The television station became an integral part of Idaho broadcasting history, creating synergies between radio and television operations that enhanced both services' community impact and commercial viability.\n\nThe adoption of the KBOI call letters marked the beginning of a brand identity that would endure for over seven decades. The call sign became synonymous with trusted news coverage and community service, establishing recognition that extends far beyond the immediate broadcast area.\n\nThe radio-television partnership created operational efficiencies and enhanced news gathering capabilities. Shared resources allowed both operations to provide more comprehensive coverage of local events, political developments, and breaking news than either could achieve independently.\n\nKBOI-TV developed into one of Idaho's most significant television operations, eventually becoming a CBS affiliate and maintaining prominence in the Boise television market. The television connection enhanced the radio station's credibility and provided cross-promotional opportunities that strengthened both brands.\n\nThe FM Connection and Station Separation\n\nFor decades, KBOI operated both AM and FM services, with the FM signal broadcasting at 97.9. This dual-frequency operation allowed the station to serve different audience segments while maintaining operational efficiency through shared programming and resources.\n\nThe FM and AM stations were eventually split, representing a strategic decision that reflected changing industry trends toward specialized programming. The FM signal became KQFC, now known as Magic 97.9, while the AM operation maintained the KBOI identity and focused increasingly on news and talk programming.\n\nThis separation proved prescient, as it allowed each frequency to develop distinct programming identities suited to their respective audience demographics and technical capabilities. The AM station's powerful signal made it ideal for news and talk programming that could reach across Idaho and neighboring states, while the FM frequency pursued music programming with superior audio quality.\n\nThe station separation also reflected broader industry trends toward format specialization and demographic targeting that emerged in the 1980s and 1990s. Rather than attempting to serve all audiences with a single service, the split allowed each station to develop focused programming strategies.\n\nEvolution to News/Talk Format\n\nKBOI's transition to news/talk programming occurred gradually, with \"the station evolved over time to feature an increasing diet of news and talk, which has been its primary programming since the early 1990s.\" This evolution reflected both audience demand and the station's recognition of its strengths in news gathering and community service.\n\nThe early 1990s represented an ideal time for news/talk format adoption, as talk radio was experiencing unprecedented growth nationally. The format's emphasis on audience interaction and local issues aligned perfectly with KBOI's established community connections and news credibility.\n\nThe transition also capitalized on the AM frequency's technical advantages for spoken word programming. The 670 AM frequency's powerful signal could reach listeners throughout Idaho and neighboring states, creating opportunities for regional influence that music formats couldn't match.\n\nThe news/talk format allowed KBOI to differentiate itself from music-focused competitors while building on its established strengths in news gathering and community involvement. This strategic positioning proved sustainable through multiple ownership changes and industry disruptions.\n\nCumulus Media Ownership and Professional Operations\n\nKBOI currently operates under Cumulus Media ownership, representing integration into one of America's largest radio broadcasting companies. This corporate structure provides resources for professional operations, national programming partnerships, and technical infrastructure that enhances the station's competitive position.\n\nThe Cumulus ownership allows KBOI to benefit from a six-station cluster that includes KIZN 92.3 FM (Country), KKGL 96.9 FM (Classic Rock), KTIK 95.3 FM (Sports), and KQFC 97.9 FM (AC). This clustering strategy enables shared resources, coordinated advertising sales, and complementary programming approaches across different demographic targets.\n\nNancy Wirth serves as Director of Sales for the Cumulus Boise radio group, bringing \"23-year veteran of radio and television sales and marketing\" experience to the operation. Her appointment in March 2022 demonstrated Cumulus's commitment to experienced regional media professionals.\n\nThe corporate structure provides access to national talk radio programming, technical support, and industry expertise while maintaining local programming autonomy. This balance allows KBOI to benefit from corporate resources while preserving the local identity that drives audience loyalty.\n\nDual-Frequency Operations and Technical Expansion\n\nIn a significant technical development, KBOI announced in December 2021 that \"KBOI-AM will soon also be KBOI-FM,\" with the station \"starting January 3rd\" broadcasting \"at 93.1 FM, and will continue at 670 AM.\" This expansion represented major investment in enhanced coverage and audience reach.\n\nThe addition of FM capability addressed technical challenges inherent in AM broadcasting, particularly \"interference from powerlines (on the AM station) being the most prevalent\" issue affecting signal quality. Program Director and afternoon host Nate Shelman explained that \"The growth in the Treasure Valley and changes in technology have warranted the need for an FM outlet.\"\n\nThe technical expansion required coordination with other station operations, as \"Sports station KTIK 93.1 FM The Ticket will move as well, to 95.3 FM.\" Cumulus built out the new 95.3 frequency specifically to accommodate this transition, though the new frequency \"reaches a significantly smaller geographic area, than 93.1 FM.\"\n\nThe dual-frequency operation allows KBOI to serve different audience segments more effectively. Boise State football will simulcast on both KBOI-FM and KBOI-AM, while \"Men's and women's basketball games will air at 670 AM only with regular programming on 93.1 FM.\" This programming split maximizes audience reach while maintaining service to sports fans.\n\nCurrent Programming and Personalities\n\nKBOI's current programming schedule features experienced professionals who represent decades of combined broadcasting experience. The morning show (5-10 AM) features \"Kasper and Chris,\" hosted by Mike Kasper and Chris Walton, representing a partnership that combines market experience with news/talk expertise.\n\nMike Kasper brings extensive local market knowledge, having \"been a staple in the Boise market since 1989 with stops at KFXD and as Program Director of CHR 'Magic 93.1' KZMG before spending 15 years in mornings at Townsquare Media Hot AC 'Mix 106' 105.9 KCIX.\" His appointment followed \"a months long nationwide search\" after the retirement of legendary morning host Paul J Schneider.\n\nKasper's career achievements include \"8 time winner of Idaho Statesman's 'Best of the Treasure Valley' for Best Morning Show, 3 time winner of Boise Weekly's 'Best of Boise' for Best Radio Personality, and 3 time winner of Idaho State Broadcasting Association's award for Best Morning Show Personality.\" These awards demonstrate sustained excellence and community recognition.\n\nChris Walton represents deep institutional knowledge as \"a Twin Falls native and Boise State alumnus\" who \"has been a fixture on Boise radio since 1983.\" His background includes experience as \"a former writer for the Twin Falls Times-News and United Press International\" and \"a past recipient of the Idaho Press Club scholarship.\"\n\nWalton's KBOI tenure began in January 2001, following previous experience at \"radio stations KBSU, KIYS, KIZN and KKGL, all in Boise.\" His recognition includes \"13 Idaho State Broadcasters Association awards, including four for Best Newscast and six consecutive wins as Best Commercial Copywriter.\" The station's parent company \"awarded Chris its 'Legend' status in 2001.\"\n\nThe Nate Shelman Show and Afternoon Programming\n\nNate Shelman serves dual roles as Program Director and afternoon drive host (3-7 PM), representing significant investment in local programming leadership. Shelman's show has become a significant force in Idaho political and social discourse, featuring regular interaction with listeners and community leaders.\n\nThe Nate Shelman Show operates \"Weekdays, 3pm to 7pm on Newstalk KBOI 93.1 FM and 670 AM\" and maintains an active podcast presence that extends the program's reach beyond traditional broadcast hours. The show's format includes \"The Potpourri Hour,\" \"The Rant Hour,\" and \"The Rave Hour,\" providing structured opportunities for listener interaction and commentary.\n\nShelman's programming demonstrates the evolution of talk radio toward multimedia engagement, with podcast distribution and social media integration extending the show's influence beyond traditional broadcast boundaries. His role as Program Director ensures coordination between programming and community involvement that strengthens the station's local connections.\n\nRecent program content includes interviews with national figures like Barry Manilow alongside local political coverage and community issues. This programming mix demonstrates KBOI's ability to attract significant guests while maintaining focus on local and regional concerns.\n\nSports Programming and Boise State Athletics\n\nKBOI serves as the flagship station for Boise State University athletics, with Bob Behler as the \"Voice of the Broncos.\" Behler brings professional sports broadcasting experience, having been \"honored by the Idaho State Broadcasters Association for his work on Boise State football.\"\n\nBehler's background includes \"nine years as director of broadcast services at UMass, where he won eight Associated Press awards for his play-by-play of Minutemen sports.\" His earlier experience includes \"nine years at Bucknell University (Penn.)\" and broadcasting for \"the Chattanooga Lookouts AA baseball team.\"\n\nThe sports programming represents significant community service and promotional value for Boise State University athletics. The broadcasts reach throughout Idaho and neighboring states, providing exposure for university athletics programs and creating emotional connections between listeners and the institution.\n\nThe technical capability to broadcast on both AM and FM frequencies ensures maximum audience reach for Boise State athletics, particularly important for football games that attract statewide attention. The dual-frequency approach allows the station to serve both traditional AM sports listeners and FM audiences seeking superior audio quality.\n\nCommunity Involvement and News Coverage\n\nKBOI maintains extensive community involvement through news coverage, public affairs programming, and event sponsorship. The station's commitment to local news gathering distinguishes it from automated or nationally programmed competitors.\n\nRon O'Brian serves as \"KBOI's Eye In The Sky,\" providing traffic reporting and aerial coverage that demonstrates the station's investment in comprehensive news coverage. O'Brian's background includes \"16 years\" as an \"Airborne Traffic Reporter\" in Portland, providing experience with metropolitan area traffic coverage.\n\nThe station's news operation includes dedicated email (news@kboi.com) and phone line (208-336-1821) for \"News, Breaking News, School Closings, etc.,\" ensuring community access for news tips and emergency information. This infrastructure supports the station's role as a primary source for breaking news and weather emergencies.\n\nKBOI's political coverage includes regular interaction with elected officials, candidate forums during election periods, and analysis of local and state government actions. This programming serves the public interest while establishing the station as a significant force in Idaho political discourse.\n\nTechnical Operations and Signal Coverage\n\nKBOI operates with powerful technical specifications that provide exceptional coverage throughout Idaho and neighboring regions. The 670 AM frequency represents one of the most powerful signals in the region, with coverage extending well beyond the immediate Boise market.\n\nThe station's facilities are located at 1419 W. Bannock Street, Boise, Idaho 83702, housing both the broadcast operations and the technical infrastructure necessary for dual-frequency operations. The facility supports live programming throughout the day while maintaining emergency broadcasting capabilities.\n\nThe 93.1 FM addition provides improved signal quality for listeners within the primary coverage area while addressing the interference issues common to AM broadcasting in urban environments. The FM signal offers superior audio quality for news/talk programming while maintaining the AM signal's extensive geographic reach.\n\nCall-in capabilities include 208-336-3700 and 1-800-529-KBOI (5264) for regular programming, plus 208-336-3711 for contest participation. These multiple access points demonstrate the station's commitment to listener interaction and community engagement.\n\nAwards and Industry Recognition\n\nKBOI has established itself as a professionally operated station earning industry recognition for programming excellence and community service. The numerous awards earned by individual personalities reflect the station's overall commitment to quality programming and community involvement.\n\nThe station's news operation has earned recognition from professional journalism organizations, demonstrating commitment to accurate reporting and public service. The Idaho State Broadcasters Association awards earned by station personnel reflect sustained excellence in multiple programming categories.\n\nChris Walton's recognition as a \"Legend\" by the station's parent company represents unusual acknowledgment of individual contribution to station success and community service. This designation reflects both programming excellence and community involvement that extends beyond traditional broadcasting responsibilities.\n\nThe station's role in training and developing broadcasting professionals contributes to the broader Idaho media community. Many station alumni have continued successful careers in broadcasting, journalism, and related fields, extending KBOI's influence throughout the region.\n\nPolitical Influence and Public Affairs\n\nKBOI has established significant influence in Idaho political discourse through regular coverage of state and local government, candidate interviews, and public affairs programming. The station's political coverage often shapes public debate on significant issues affecting Idaho residents.\n\nThe station's commitment to political coverage includes regular interaction with elected officials from local mayors to congressional representatives. This access enables comprehensive coverage of political developments while providing accountability journalism that serves the public interest.\n\nDuring election periods, KBOI provides candidate forums, debate coverage, and analysis that helps voters make informed decisions. The station's political coverage maintains professional standards while accommodating diverse viewpoints and encouraging public participation in democratic processes.\n\nThe station's political influence extends beyond Idaho borders through its powerful signal reach and podcast distribution. Political leaders recognize KBOI as a significant forum for reaching Idaho voters and explaining policy positions on issues affecting the region.\n\nDigital Innovation and Multimedia Presence\n\nKBOI has embraced digital technology while maintaining traditional radio's community connection and immediacy. The station's website provides streaming access, program archives, and community information that extends the broadcast experience beyond traditional radio hours.\n\nPodcast distribution of major programs like The Nate Shelman Show creates opportunities for time-shifted listening and extends the station's reach to audiences who cannot listen during traditional broadcast hours. This multimedia approach reflects modern radio's need to serve audiences across multiple platforms.\n\nSocial media integration allows real-time interaction between on-air personalities and listeners, creating community engagement that supplements traditional call-in programming. This digital presence reinforces the station's position as a comprehensive news and information source.\n\nThe station's digital strategy includes mobile accessibility and app-based listening options that ensure audience access regardless of location or device. This technological approach maintains KBOI's relevance for younger demographics while preserving traditional radio's immediacy and local focus.\n\nCompetitive Position and Market Leadership\n\nKBOI has established market leadership in news/talk programming through consistent audience ratings and advertiser support. The station's combination of experienced personalities, comprehensive news coverage, and community involvement creates competitive advantages that protect against format competition.\n\nThe dual-frequency operation provides technical advantages that competitors cannot easily match, particularly the combination of extensive AM coverage with FM audio quality. This technical superiority enhances programming effectiveness while creating barriers to competitive entry.\n\nThe station's Cumulus Media ownership provides resources for equipment upgrades, programming development, and promotional activities that independent operators cannot match. This corporate support enables sustained investment in programming quality and technical capabilities.\n\nKBOI's established relationships with news sources, elected officials, and community organizations create content advantages that new competitors would require years to develop. These institutional relationships provide ongoing story development and exclusive access that enhances programming value.\n\nFuture Challenges and Opportunities\n\nKBOI faces the same challenges confronting traditional radio in an era of podcasting, streaming services, and changing media consumption habits. The station's response emphasizes live, local programming and community connection as competitive advantages that digital alternatives cannot easily replicate.\n\nThe growing Boise market provides opportunities for audience expansion as Idaho continues attracting new residents from other states. KBOI's established brand recognition and comprehensive coverage position the station well for capturing new listeners while maintaining existing audience loyalty.\n\nPolitical polarization presents both opportunities and challenges for news/talk programming. KBOI's approach emphasizes professional journalism standards and community service while accommodating diverse political viewpoints that reflect Idaho's complex political landscape.\n\nTechnological changes in broadcasting and digital media require ongoing investment in equipment and programming approaches. KBOI's corporate resources and professional management provide capabilities for adapting to technological changes while preserving the local identity that drives audience loyalty.\n\nLegacy and Cultural Impact\n\nKBOI represents more than a commercial radio station\u2014it serves as a cultural institution that has shaped Idaho's political discourse, community development, and media landscape for nearly eight decades. The station's evolution from full-service radio to multimedia news/talk operation mirrors broader changes in American broadcasting and journalism.\n\nThe station's commitment to local programming and community service demonstrates how traditional media can maintain relevance and influence in the digital age. KBOI's success proves that professional journalism and community engagement create sustainable competitive advantages that transcend technological disruption.\n\nThe station's role in training broadcasting professionals and supporting journalism education contributes to Idaho's media infrastructure and democratic institutions. This educational function extends KBOI's impact beyond immediate programming to long-term community development and civic engagement.\n\nKBOI's influence on Idaho political discourse, community development, and emergency communication demonstrates the continuing importance of local broadcasting in American democracy. The station's commitment to public service and professional journalism provides a model for how commercial broadcasting can serve the public interest while maintaining financial viability.\n\nConclusion\n\nKBOI 93.1 FM/670 AM stands as a testament to the enduring power of local broadcasting when executed with professional excellence, community commitment, and adaptability to changing technology and audience needs. From its origins as KDSH in 1947 through its current position as \"Idaho's News Talk Authority,\" KBOI has demonstrated remarkable continuity of purpose while adapting to multiple technological and industry changes.\n\nThe station's success under Cumulus Media ownership illustrates how corporate resources can enhance rather than diminish local broadcasting's community impact. Through experienced personalities, comprehensive news coverage, dual-frequency technical capabilities, and deep community involvement, KBOI has created a sustainable model for news/talk radio success that serves both commercial and public interest objectives.\n\nAs KBOI approaches its eighth decade of broadcasting, its combination of traditional journalism values, modern technical capabilities, and community engagement positions it well for continued success. The station's ability to balance corporate efficiency with local identity, professional journalism with entertainment value, and traditional broadcasting with digital innovation provides a blueprint for how local radio can thrive in an increasingly complex media environment.\n\nMost importantly, KBOI's consistent commitment to serving its community while informing and engaging listeners demonstrates that quality local broadcasting remains an essential component of American democratic discourse. The station's influence on Idaho politics, community development, and civic engagement proves that professional local media continues to play a vital role in maintaining informed citizenship and democratic participation."
}