{
  "callLetters": "KBSU",
  "frequency": "90.3 FM",
  "location": "Boise, Idaho",
  "format": "Non-Commercial Educational",
  "stationName": "KBSU - Boise State University Radio",
  "established": "1970s",
  "synopsis": "KBSU 90.3 FM stands as Boise State University's non-commercial educational radio station, representing over five decades of commitment to public service broadcasting, educational programming, and community engagement.",
  "fullContent": "KBSU 90.3 FM stands as Boise State University's non-commercial educational radio station, representing over five decades of commitment to public service broadcasting, educational programming, and community engagement. Licensed to Boise State University and broadcasting with 3,000 watts from Boise, Idaho, KBSU has evolved from its origins as a small campus station into a significant voice in the Treasure Valley's media landscape. Operating under the call letters that directly reflect its institutional affiliation (K-BSU), the station serves multiple constituencies including university students, faculty, and staff, as well as the broader Boise metropolitan community. KBSU's programming philosophy emphasizes educational content, cultural programming, news and public affairs, and music that reflects diverse artistic traditions often underrepresented on commercial radio. As a non-commercial educational station, KBSU operates without traditional advertising, instead relying on university support, listener contributions, and underwriting from local businesses and organizations that share its commitment to educational and cultural programming. The station's role extends beyond entertainment to include emergency broadcasting, community information services, and providing a platform for local voices and perspectives that might not otherwise reach broadcast audiences.\n\nSTATION HISTORY AND DEVELOPMENT\n\nEarly Years and Campus Radio Origins (1970s)\n\nKBSU's broadcasting history began in the early 1970s as part of Boise State University's expanding communications and media programs. The station's establishment reflected the university's commitment to providing practical learning opportunities for students studying broadcasting, journalism, and related fields while serving the campus community's information and entertainment needs.\n\nInitial Operations and Campus Focus\n\nDuring its early years, KBSU operated primarily as a campus radio station with limited coverage area and programming focused on university activities:\n\nProgramming Elements:\n\u2022 Campus news and information serving students, faculty, and staff\n\u2022 Music programming reflecting student tastes and cultural interests\n\u2022 Educational content supporting academic programs and university mission\n\u2022 Sports coverage featuring Boise State University athletic events\n\u2022 Community calendar promoting campus activities and events\n\nTechnical Development:\n\u2022 Low-power operations serving primarily the campus and immediate surrounding area\n\u2022 Student-operated programming providing hands-on learning experiences\n\u2022 Basic studio facilities supporting educational objectives rather than commercial broadcasting standards\n\u2022 Volunteer staff consisting primarily of students and faculty members\n\nEducational Mission Integration\n\nFrom its inception, KBSU served as a laboratory for students learning broadcasting and media production:\n\nAcademic Integration:\n\u2022 Practical experience for communications and journalism students\n\u2022 Training opportunities in radio production, news gathering, and on-air presentation\n\u2022 Technical education in broadcast engineering and station operations\n\u2022 Media literacy development through hands-on involvement in programming decisions\n\nCommunity Service Development:\n\u2022 Information services for campus community during emergencies and important events\n\u2022 Cultural programming exposing audiences to diverse musical and artistic traditions\n\u2022 Public affairs content addressing issues relevant to university and local communities\n\u2022 Alternative programming providing content not available through commercial stations\n\nGrowth and Expansion (1980s-1990s)\n\nAs Boise State University grew and developed, KBSU expanded its operations and increased its community impact:\n\nTechnical Improvements\n\nPower Increase and Coverage Expansion:\n\u2022 Transmitter upgrades increasing signal strength and coverage area\n\u2022 Antenna improvements providing better signal quality throughout the Treasure Valley\n\u2022 Studio facility enhancements supporting more sophisticated programming\n\u2022 Equipment modernization keeping pace with broadcasting technology developments\n\nProgramming Evolution:\n\u2022 Expanded news coverage including local and regional issues beyond campus activities\n\u2022 Music programming diversification featuring genres underrepresented on commercial radio\n\u2022 Public affairs programming addressing community issues and concerns\n\u2022 Cultural programming highlighting local arts, literature, and intellectual activities\n\nProfessional Development\n\nStaff and Operations Growth:\n\u2022 Professional staff additions providing continuity and expertise beyond student volunteers\n\u2022 Training program development ensuring consistent quality and FCC compliance\n\u2022 Community outreach initiatives building relationships with local organizations and listeners\n\u2022 Fundraising activities supporting station operations and equipment improvements\n\nEducational Program Enhancement:\n\u2022 Curriculum integration providing structured learning experiences for students\n\u2022 Internship opportunities connecting students with professional broadcasting careers\n\u2022 Guest speaker programs bringing industry professionals to campus\n\u2022 Production training expanding beyond basic on-air skills to include technical and management aspects\n\nModern Era Development (2000s-Present)\n\nDigital Technology Integration\n\nKBSU has embraced digital broadcasting and internet technologies to expand its reach and improve service quality:\n\nTechnical Modernization:\n\u2022 Digital audio systems improving sound quality and production capabilities\n\u2022 Internet streaming extending reach beyond terrestrial coverage area\n\u2022 Social media integration connecting with audiences through multiple platforms\n\u2022 Mobile accessibility ensuring programming availability across various devices\n\nProgramming Innovation:\n\u2022 Podcast development extending programming beyond traditional broadcast hours\n\u2022 Online content creation supplementing on-air programming\n\u2022 Interactive programming encouraging listener participation and feedback\n\u2022 Archive development preserving significant programming for future access\n\nCommunity Partnership Expansion\n\nEnhanced Community Engagement:\n\u2022 Local business underwriting supporting station operations while promoting community enterprises\n\u2022 Non-profit organization partnerships providing programming and promotional opportunities\n\u2022 Cultural institution collaboration featuring museums, theaters, and arts organizations\n\u2022 Educational outreach extending university resources to broader community\n\nPublic Service Enhancement:\n\u2022 Emergency broadcasting capabilities providing critical information during disasters and emergencies\n\u2022 Public health information dissemination supporting community wellness initiatives\n\u2022 Civic engagement programming encouraging informed participation in democratic processes\n\u2022 Environmental awareness content addressing regional and global sustainability issues\n\nCURRENT PROGRAMMING AND OPERATIONS\n\nProgramming Philosophy and Content Standards\n\nKBSU's programming reflects its educational mission and commitment to public service:\n\nEducational Content Priorities:\n\u2022 Intellectual programming challenging listeners to engage with complex ideas and issues\n\u2022 Cultural programming exposing audiences to diverse artistic and literary traditions\n\u2022 News and public affairs content providing in-depth analysis beyond commercial media coverage\n\u2022 Music programming featuring genres and artists often overlooked by commercial stations\n\nQuality Standards:\n\u2022 Professional production values ensuring broadcast quality while maintaining educational focus\n\u2022 Content accuracy and reliability supporting the station's credibility as an information source\n\u2022 Community relevance addressing issues and interests specific to the Treasure Valley region\n\u2022 Educational value providing learning opportunities for both participants and audiences\n\nMusic Programming\n\nKBSU's music programming distinguishes the station from commercial alternatives:\n\nGenre Diversity:\n\u2022 Classical music programming featuring both well-known and lesser-known composers and performers\n\u2022 Jazz programming spanning traditional and contemporary styles\n\u2022 World music exposing listeners to international musical traditions\n\u2022 Independent and alternative music supporting emerging and non-commercial artists\n\u2022 Folk and acoustic music celebrating traditional and contemporary singer-songwriter traditions\n\nProgramming Approach:\n\u2022 Album-oriented programming allowing for complete artistic works rather than just popular singles\n\u2022 Educational context providing background information about artists, composers, and musical traditions\n\u2022 Live performance features showcasing local and touring musicians\n\u2022 Specialty programming focusing on specific genres, time periods, or cultural traditions\n\nNews and Public Affairs Programming\n\nKBSU provides news and public affairs content that complements and extends beyond commercial media coverage:\n\nLocal News Focus:\n\u2022 Boise State University news covering campus activities, research, and community impact\n\u2022 Local government coverage including city council, county commission, and school board meetings\n\u2022 Community issue analysis providing in-depth examination of local concerns and developments\n\u2022 Regional news coverage extending beyond Boise to include rural Idaho communities and issues\n\nNational and International Content:\n\u2022 Public radio network programming providing comprehensive news coverage\n\u2022 Documentary programming exploring complex national and international issues\n\u2022 Analysis and commentary offering diverse perspectives on current events\n\u2022 Educational programming addressing historical and cultural contexts for contemporary issues\n\nCultural and Educational Programming\n\nKBSU's commitment to education extends beyond formal academic content:\n\nArts and Culture:\n\u2022 Local arts coverage featuring galleries, theaters, and cultural events\n\u2022 Author interviews and literary programming supporting regional and national writers\n\u2022 Historical programming exploring Idaho and regional history\n\u2022 Science and technology programming making complex subjects accessible to general audiences\n\nCommunity Voices:\n\u2022 Local talk programming providing platforms for community leaders and activists\n\u2022 Minority and underrepresented group programming ensuring diverse voices reach broadcast audiences\n\u2022 Religious and spiritual programming reflecting the community's diverse faith traditions\n\u2022 Senior citizen programming addressing issues and interests of older community members\n\nTECHNICAL OPERATIONS AND FACILITIES\n\nTransmission and Coverage\n\nKBSU operates with technical specifications designed to serve the Boise metropolitan area effectively:\n\nTransmission Specifications:\n\u2022 Frequency: 90.3 MHz FM providing high-quality stereo audio\n\u2022 Power: 3,000 watts ensuring adequate coverage throughout the Treasure Valley\n\u2022 Antenna: Located to optimize coverage while minimizing interference with other stations\n\u2022 Coverage Area: Primary service to Boise metropolitan area with secondary coverage extending into rural Idaho communities\n\nSignal Quality and Reliability:\n\u2022 FM stereo capability providing high-quality audio for music and spoken word programming\n\u2022 Backup systems ensuring continued operation during equipment failures or emergencies\n\u2022 Regular maintenance schedules maintaining consistent signal quality and regulatory compliance\n\u2022 Emergency broadcasting capabilities supporting community safety and information needs\n\nStudio and Production Facilities\n\nKBSU operates from facilities designed to support both educational and professional broadcasting:\n\nLocation and Accessibility:\n\u2022 Campus location providing convenient access for students, faculty, and community guests\n\u2022 Professional studio design supporting high-quality programming production\n\u2022 Multiple studio configuration allowing for live programming while preparing recorded content\n\u2022 Accessible design ensuring compliance with disability access requirements\n\nTechnical Capabilities:\n\u2022 Digital audio systems providing professional-quality sound production\n\u2022 Remote broadcasting equipment supporting live coverage of community events\n\u2022 Internet streaming infrastructure extending reach beyond terrestrial coverage\n\u2022 Archive and storage systems preserving significant programming for future access\n\nEducational Integration:\n\u2022 Student training facilities providing hands-on learning opportunities\n\u2022 Equipment designed for both professional use and educational instruction\n\u2022 Safety systems ensuring secure operations while allowing student access and participation\n\u2022 Flexible configuration supporting various educational and programming needs\n\nCOMMUNITY IMPACT AND PUBLIC SERVICE\n\nEducational Mission and University Connection\n\nKBSU's role as a university-licensed station creates unique opportunities for community education:\n\nAcademic Outreach:\n\u2022 Faculty expertise sharing through interviews and guest programming\n\u2022 Research dissemination making university research accessible to general audiences\n\u2022 Continuing education programming supporting lifelong learning in the community\n\u2022 Student showcase opportunities providing platforms for emerging talent and academic achievement\n\nCultural Leadership:\n\u2022 Arts advocacy supporting local cultural institutions and events\n\u2022 Intellectual programming challenging audiences to engage with complex ideas\n\u2022 Diversity promotion ensuring multiple perspectives reach broadcast audiences\n\u2022 Community dialogue facilitation providing neutral forums for discussing controversial issues\n\nPublic Service and Emergency Broadcasting\n\nKBSU serves essential public service functions beyond entertainment and education:\n\nEmergency Services:\n\u2022 Emergency Alert System participation providing critical information during disasters\n\u2022 Weather information and warnings protecting community safety\n\u2022 Campus emergency communications supporting university safety protocols\n\u2022 Community resource information connecting residents with essential services\n\nCivic Engagement:\n\u2022 Election coverage providing comprehensive information about candidates and issues\n\u2022 Government meeting coverage ensuring transparency and public access to decision-making processes\n\u2022 Public forum programming allowing community members to discuss local issues\n\u2022 Voter education initiatives supporting informed democratic participation\n\nCommunity Building and Social Cohesion\n\nKBSU contributes to community identity and social connection:\n\nLocal Identity Promotion:\n\u2022 Regional history programming celebrating Idaho heritage and culture\n\u2022 Local business and organization promotion supporting community economic development\n\u2022 Community event coverage building awareness and participation in local activities\n\u2022 Volunteer opportunity promotion connecting residents with service opportunities\n\nCultural Bridge Building:\n\u2022 Multicultural programming celebrating the community's diversity\n\u2022 Intergenerational programming connecting different age groups through shared interests\n\u2022 Economic diversity awareness addressing issues affecting various socioeconomic groups\n\u2022 Rural-urban connection programming bridging differences between city and country residents\n\nFINANCIAL MODEL AND SUSTAINABILITY\n\nNon-Commercial Operations and Funding\n\nAs a non-commercial educational station, KBSU operates under different financial constraints and opportunities than commercial broadcasters:\n\nUniversity Support:\n\u2022 Institutional funding providing basic operational support and facility maintenance\n\u2022 Student fee allocation supporting programming and equipment needs\n\u2022 Faculty and staff time contribution providing expertise and continuity\n\u2022 Facility provision including studio space, utilities, and technical infrastructure\n\nCommunity Support:\n\u2022 Listener contributions through membership drives and individual donations\n\u2022 Local business underwriting providing revenue while supporting community enterprises\n\u2022 Grant funding from foundations and government agencies supporting educational and cultural programming\n\u2022 Volunteer assistance reducing operational costs while building community engagement\n\nRevenue Diversification:\n\u2022 Special event fundraising building community support while generating revenue\n\u2022 Merchandise sales promoting station identity while providing supplemental income\n\u2022 Educational service contracts providing training and consultation to other organizations\n\u2022 Facility rental for community events generating revenue while serving public needs\n\nOperational Efficiency and Cost Management\n\nKBSU maintains financial sustainability through careful resource management:\n\nEfficient Operations:\n\u2022 Volunteer programming reducing personnel costs while providing community involvement opportunities\n\u2022 Equipment sharing with university academic programs maximizing resource utilization\n\u2022 Energy-efficient operations reducing utility costs and environmental impact\n\u2022 Preventive maintenance extending equipment life and reducing replacement costs\n\nStrategic Planning:\n\u2022 Long-term equipment replacement planning ensuring continued technical capability\n\u2022 Programming development balancing educational mission with audience appeal\n\u2022 Community partnership development creating mutual support relationships\n\u2022 Technology adoption improving efficiency while maintaining service quality\n\nFUTURE OUTLOOK AND STRATEGIC DIRECTION\n\nTechnology Integration and Digital Expansion\n\nKBSU continues to adapt to changing media consumption patterns and technological opportunities:\n\nDigital Platform Development:\n\u2022 Podcast programming extending content beyond traditional broadcast hours\n\u2022 Social media engagement building stronger connections with audiences\n\u2022 Mobile application development improving accessibility and user experience\n\u2022 Online content creation supplementing broadcast programming with additional resources\n\nStreaming and On-Demand Services:\n\u2022 Internet radio expansion reaching audiences beyond terrestrial coverage area\n\u2022 Archive development providing access to past programming and educational content\n\u2022 Interactive programming encouraging real-time audience participation\n\u2022 Multimedia content creation combining audio with visual and text elements\n\nEducational Innovation and Community Engagement\n\nKBSU's educational mission drives continued innovation in programming and community service:\n\nAcademic Integration Enhancement:\n\u2022 Curriculum development incorporating radio production into various academic disciplines\n\u2022 Research dissemination improving public access to university-generated knowledge\n\u2022 Student opportunity expansion providing more hands-on learning experiences\n\u2022 Community education programming serving lifelong learning needs\n\nCommunity Partnership Development:\n\u2022 Cultural institution collaboration creating comprehensive community cultural programming\n\u2022 Non-profit organization support providing platforms for community service organizations\n\u2022 Local government partnership enhancing civic engagement and transparency\n\u2022 Business community engagement supporting economic development while maintaining non-commercial integrity\n\nSustainability and Environmental Responsibility\n\nKBSU demonstrates leadership in environmental stewardship:\n\nOperational Sustainability:\n\u2022 Energy-efficient equipment reducing environmental impact and operational costs\n\u2022 Paperless operations minimizing waste and improving efficiency\n\u2022 Sustainable transportation promotion supporting community environmental goals\n\u2022 Green building practices in facility maintenance and improvement\n\nProgramming Leadership:\n\u2022 Environmental education programming raising awareness about sustainability issues\n\u2022 Local food and agriculture promotion supporting regional sustainability initiatives\n\u2022 Climate change education providing scientific information about environmental challenges\n\u2022 Conservation programming encouraging individual and community environmental responsibility\n\nKBSU 90.3 FM represents the vital role that non-commercial educational radio plays in American communities. Through its commitment to educational programming, cultural diversity, public service, and community engagement, the station provides services and perspectives that commercial media cannot or will not offer. As a university-licensed station, KBSU bridges academic and community worlds, making higher education resources accessible to broader audiences while providing practical learning opportunities for students.\n\nThe station's success demonstrates that public service broadcasting remains relevant and valuable in an era of media consolidation and commercial pressures. KBSU's ability to serve multiple constituencies\u2014university community, local residents, cultural organizations, and civic groups\u2014illustrates how educational radio can build social cohesion and promote informed citizenship.\n\nLooking toward the future, KBSU's integration of traditional broadcasting with digital technologies positions it well for continued relevance and growth. The station's commitment to educational excellence, community service, and cultural programming ensures its continued importance as a unique voice in the Treasure Valley's media landscape, providing content and perspectives that enrich community life and support democratic participation."
}