{
  "callLetters": "KFXD",
  "frequency": "103.3 FM",
  "location": "Boise, Idaho",
  "format": "Contemporary Hit Radio (CHR)",
  "stationName": "103.3 The Fox",
  "established": "Various",
  "synopsis": "KFXD 103.3 FM represents a significant presence in Idaho's radio broadcasting landscape, operating as \"The Fox\" with a contemporary hit radio (CHR) format that has established it as a leading voice for younger demographics throughout the Treasure Valley.",
  "fullContent": "KFXD 103.3 FM represents a significant presence in Idaho's radio broadcasting landscape, operating as \"The Fox\" with a contemporary hit radio (CHR) format that has established it as a leading voice for younger demographics throughout the Treasure Valley. Licensed to serve the Boise metropolitan area, KFXD has built a reputation for delivering current popular music, engaging personality programming, and community involvement that reflects the energy and diversity of Idaho's growing urban population. The station's evolution from its original establishment through various format changes to its current successful CHR positioning demonstrates the dynamic nature of radio broadcasting and the importance of adapting to changing audience preferences while maintaining authentic connections to local communities.\n\nSTATION HISTORY AND DEVELOPMENT\n\nEarly Establishment and Original Operations\n\nKFXD's broadcasting history began during a period of significant expansion in FM radio development, when the Federal Communications Commission was actively encouraging the establishment of new FM stations to provide programming alternatives and serve specialized audience needs. The station's original establishment reflected growing recognition that FM's superior audio quality made it particularly suitable for music programming and that the expanding FM spectrum could accommodate more diverse programming approaches than the crowded AM band.\n\nInitial Technical Parameters:\n\u2022 FM frequency allocation at 103.3 MHz providing high-quality stereo audio capability\n\u2022 Transmitter location strategically positioned to serve the greater Boise metropolitan area\n\u2022 Power levels designed to provide reliable coverage throughout the Treasure Valley while maintaining signal quality\n\u2022 Antenna configuration optimized for the region's varied topography and urban development patterns\n\nEarly Programming Development:\n\u2022 Music-focused programming taking advantage of FM's superior audio reproduction capabilities\n\u2022 Format selection designed to serve audience segments not adequately addressed by existing Boise area stations\n\u2022 Community service programming fulfilling FCC requirements while building local listener connections\n\u2022 Technical quality emphasis distinguishing FM programming from AM alternatives in the competitive market\n\nMarket Entry and Competitive Environment\n\nKFXD entered a radio market that was experiencing rapid growth and increasing sophistication:\n\nMarket Conditions at Launch:\n\u2022 Boise's expanding metropolitan population creating opportunities for specialized programming approaches\n\u2022 Growing youth demographic seeking contemporary music programming with local relevance\n\u2022 Limited CHR competition allowing new stations to establish distinct market positions in popular music formats\n\u2022 Technological improvements making FM receivers more affordable and widely available to target demographics\n\nInitial Format Strategy:\n\u2022 Contemporary music programming emphasizing current hits and emerging artists\n\u2022 Target audience development focusing on younger demographics attracted to current popular music\n\u2022 Programming schedule structure balancing music content with personality programming and community information\n\u2022 Local programming integration building connections with Treasure Valley youth culture and community activities\n\nFormat Evolution and Programming Development\n\nThroughout its operational history, KFXD has undergone several format refinements while maintaining its core contemporary music identity:\n\nEarly Format Periods:\n\u2022 Contemporary hit radio programming serving demographics seeking current popular music\n\u2022 Top 40 format elements incorporating both current hits and recent popular music\n\u2022 Dance and electronic music integration reflecting evolving popular music trends\n\u2022 Local music promotion supporting regional artists and building community cultural connections\n\nProgramming Innovation and Adaptation:\n\u2022 Music format refinement responding to changing popular music trends and audience preferences\n\u2022 Personality programming development featuring local talent with authentic connections to youth culture\n\u2022 Promotional strategy evolution building brand recognition and listener loyalty among target demographics\n\u2022 Community involvement initiatives establishing the station as an active participant in regional youth-oriented activities\n\nThe Evolution to \"The Fox\" Branding\n\nKFXD's adoption of \"The Fox\" branding represented a strategic response to market research and the need for distinctive brand identity:\n\nBrand Development:\n\u2022 \"The Fox\" identity creation reflecting energy, intelligence, and contemporary appeal\n\u2022 Marketing strategy emphasizing the station's connection to current popular culture and music trends\n\u2022 Programming philosophy balancing current hits with personality programming and community engagement\n\u2022 Visual and audio branding elements creating consistent identity across all station communications\n\nContemporary Hit Radio Positioning:\n\u2022 CHR format adoption serving audience demand for current popular music programming\n\u2022 Music selection strategy incorporating current hits, emerging artists, and popular recurrents\n\u2022 Personality programming featuring morning shows and drive-time programming with local relevance\n\u2022 Community positioning establishing the station as the voice of Treasure Valley youth culture\n\nCURRENT OPERATIONS AS \"103.3 THE FOX\"\n\nProgramming Philosophy and Music Selection\n\nKFXD's current identity as \"103.3 The Fox\" reflects a carefully developed approach to contemporary hit radio programming:\n\nMusic Programming Strategy:\n\u2022 Current hit radio format emphasizing the most popular contemporary music across multiple genres\n\u2022 Chart-based music selection incorporating Billboard Hot 100 and other relevant music industry charts\n\u2022 Emerging artist integration providing exposure for new music while maintaining format consistency\n\u2022 Local and regional artist support when music fits format parameters and audience expectations\n\nProgramming Elements:\n\u2022 Morning show programming featuring local personalities with strong connections to contemporary culture\n\u2022 Drive-time programming designed to serve commuter audiences with music, information, and entertainment\n\u2022 Weekend specialty programming exploring specific genres or themes within the contemporary music spectrum\n\u2022 Community information integration including local event promotion and regional business support\n\nTarget Audience and Market Position\n\nKFXD serves specific demographic segments within the competitive Boise radio market:\n\nPrimary Audience Characteristics:\n\u2022 Young adults and teenagers seeking current popular music and contemporary cultural programming\n\u2022 Demographics interested in emerging music trends and popular culture developments\n\u2022 Active lifestyle audiences who value high-energy programming and community connection\n\u2022 Music enthusiasts who prefer current hits over classic or alternative music formats\n\nMarket Positioning Strategy:\n\u2022 Differentiation from competitors through music currency and personality programming quality\n\u2022 Community integration ensuring programming reflects local interests and cultural activities\n\u2022 Energy emphasis maintaining high-tempo programming that matches audience lifestyle and preferences\n\u2022 Trend leadership positioning the station as a source for discovering new music and cultural developments\n\nTechnical Operations and Broadcast Quality\n\nKFXD maintains technical standards designed to provide superior audio quality and reliable service:\n\nTransmission Specifications:\n\u2022 103.3 FM frequency providing high-quality stereo audio reproduction ideal for contemporary music\n\u2022 Power levels ensuring comprehensive coverage throughout the Treasure Valley metropolitan area\n\u2022 Signal monitoring systems maintaining consistent audio standards and preventing technical problems\n\u2022 Backup systems ensuring continued operation during equipment failures or emergency situations\n\nProduction Capabilities:\n\u2022 Digital audio systems supporting both live and recorded programming with professional quality standards\n\u2022 Multi-track production facilities enabling sophisticated local content creation and commercial production\n\u2022 Remote broadcasting equipment supporting live coverage of concerts, events, and promotional activities\n\u2022 Internet streaming infrastructure extending reach beyond terrestrial coverage to online and mobile audiences\n\nCOMMUNITY ENGAGEMENT AND LOCAL PROGRAMMING\n\nCommunity Connection and Youth Culture\n\nKFXD demonstrates its commitment to serving the Treasure Valley through various local programming and community service initiatives:\n\nLocal Programming Elements:\n\u2022 Concert and music event promotion supporting regional entertainment venues and cultural activities\n\u2022 Local artist interviews and music promotion when artists fit contemporary format parameters\n\u2022 Community event coverage focusing on activities relevant to younger demographic audiences\n\u2022 High school and college event promotion building connections with educational institutions\n\nCultural Programming:\n\u2022 Popular culture programming addressing trends, entertainment, and lifestyle topics relevant to target audiences\n\u2022 Technology and social media integration reflecting contemporary communication preferences\n\u2022 Fashion, entertainment, and lifestyle content addressing interests of younger demographic segments\n\u2022 Local business promotion focusing on establishments and services relevant to target audience interests\n\nPublic Service and Community Involvement\n\nKFXD fulfills important community service functions while maintaining its entertainment focus:\n\nCommunity Services:\n\u2022 Emergency Alert System participation providing critical information during disasters and emergencies\n\u2022 Public service announcement broadcasting supporting causes and organizations relevant to younger audiences\n\u2022 Educational institution support promoting academic and extracurricular activities\n\u2022 Health and safety information targeting issues relevant to younger demographic segments\n\nPromotional Activities:\n\u2022 Concert promotion and ticket giveaways building audience engagement while supporting regional entertainment\n\u2022 Community festival participation connecting the station with local cultural and entertainment events\n\u2022 Charity support focusing on causes that resonate with younger demographic audiences\n\u2022 Social media engagement building interactive relationships with listeners across digital platforms\n\nECONOMIC MODEL AND MARKET PERFORMANCE\n\nRevenue Generation and Financial Structure\n\nKFXD operates under a commercial broadcasting model that balances revenue generation with audience service:\n\nAdvertising Revenue:\n\u2022 Youth-oriented business advertising targeting companies seeking to reach younger demographic segments\n\u2022 Entertainment and lifestyle advertising from businesses serving target audience interests and needs\n\u2022 Automotive advertising targeting younger car buyers and those interested in contemporary vehicle options\n\u2022 Technology and consumer electronics advertising serving audience interests in current technology trends\n\nPromotional Activities:\n\u2022 Concert and entertainment event sponsorship building brand recognition while supporting regional activities\n\u2022 Festival and community event participation creating promotional opportunities while serving audience interests\n\u2022 Contest and giveaway programming building audience engagement while creating advertiser value\n\u2022 Social media marketing integration extending promotional reach beyond traditional broadcasting\n\nMarket Performance and Competitive Position\n\nKFXD maintains its market position through strategic differentiation and contemporary programming:\n\nCompetitive Advantages:\n\u2022 Current music programming serving audiences seeking the most contemporary popular music\n\u2022 Personality programming featuring local talent with authentic connections to youth culture and contemporary trends\n\u2022 Community engagement focusing on activities and interests relevant to target demographic segments\n\u2022 Technology integration providing multi-platform access and interactive audience engagement opportunities\n\nStrategic Planning:\n\u2022 Music research and audience feedback integration informing programming decisions and playlist development\n\u2022 Social media and digital platform development extending station reach and audience engagement\n\u2022 Community partnership development creating mutual benefit relationships with youth-oriented organizations\n\u2022 Technology adoption improving service quality while maintaining cost effectiveness and audience appeal\n\nFUTURE OUTLOOK AND STRATEGIC DIRECTION\n\nTechnology Integration and Digital Expansion\n\nKFXD continues to adapt to changing media consumption patterns while maintaining its contemporary music focus:\n\nDigital Platform Development:\n\u2022 Internet streaming expansion reaching audiences beyond traditional terrestrial coverage area\n\u2022 Social media integration building stronger connections with listeners and promoting community engagement\n\u2022 Mobile app development providing enhanced access to programming and interactive features\n\u2022 Podcast and on-demand content development supplementing live programming with specialized content\n\nInteractive Programming:\n\u2022 Listener participation opportunities encouraging audience engagement through multiple communication channels\n\u2022 Real-time social media integration enabling immediate response to audience feedback and music requests\n\u2022 Community event integration connecting broadcast programming with local entertainment and cultural activities\n\u2022 Contest and promotional activities building audience engagement while supporting local businesses and events\n\nCommunity Partnership and Service Expansion\n\nKFXD's future development emphasizes strengthened community connections and expanded youth-oriented service:\n\nPartnership Development:\n\u2022 Educational institution collaboration supporting student activities and academic community engagement\n\u2022 Entertainment venue partnership promoting concerts and cultural events while building audience loyalty\n\u2022 Youth organization support providing promotional platforms for activities serving younger demographic segments\n\u2022 Technology company partnership exploring innovative programming and audience engagement opportunities\n\nService Enhancement:\n\u2022 Programming diversity expansion serving broader youth interests while maintaining contemporary music core\n\u2022 Community event coverage increasing local relevance and building stronger connections with target audiences\n\u2022 Educational content development addressing topics relevant to younger demographic segments\n\u2022 Digital service expansion providing enhanced access and interactive opportunities for audience engagement\n\nInnovation and Trend Leadership\n\nKFXD demonstrates leadership in contemporary programming and technological innovation:\n\nProgramming Innovation:\n\u2022 Music discovery programming introducing audiences to emerging artists and trends\n\u2022 Interactive programming utilizing current technology to enhance audience engagement and participation\n\u2022 Social media integration creating seamless connections between broadcast and digital platforms\n\u2022 Community trend identification ensuring programming remains relevant to evolving youth culture and interests\n\nTechnology Leadership:\n\u2022 Digital platform development providing cutting-edge access to programming and interactive features\n\u2022 Social media strategy innovation building stronger audience relationships through contemporary communication methods\n\u2022 Mobile technology integration ensuring programming accessibility across all devices and platforms\n\u2022 Data analytics utilization improving programming decisions and audience service through informed decision-making\n\nKFXD 103.3 FM's position as \"The Fox\" in the Treasure Valley's radio landscape demonstrates the station's successful adaptation to contemporary music trends and youth culture while maintaining strong community connections. Through its commitment to current popular music, engaging personality programming, and community involvement, the station has established itself as a leading voice for younger demographics in the competitive Boise radio market.\n\nThe station's success illustrates how contemporary hit radio can serve specific demographic segments while building sustainable business relationships with advertisers seeking to reach younger audiences. KFXD's emphasis on music currency, personality programming, and community engagement creates competitive advantages that differentiate it from both contemporary and alternative format competitors.\n\nLooking toward the future, KFXD's integration of traditional contemporary radio programming with digital technologies and enhanced community engagement positions the station well for continued growth and market leadership. The station's commitment to serving younger audiences while adapting to changing technology and media consumption patterns ensures its continued relevance as a distinctive voice in Idaho's radio landscape.\n\nThe station's ongoing evolution reflects the dynamic nature of contemporary hit radio and the continued opportunities for stations that genuinely connect with their target audiences while embracing technological innovation and community engagement. KFXD's success demonstrates that specialized programming and authentic community connection can create sustainable competitive advantages in metropolitan radio markets."
}