{
  "callLetters": "KKGL",
  "frequency": "96.9 FM",
  "location": "Nampa/Boise, Idaho",
  "format": "Classic Rock",
  "stationName": "96.9 The Eagle",
  "established": "1977",
  "synopsis": "KKGL 96.9 FM \"The Eagle\" represents nearly five decades of radio evolution, transforming from KUUZ Top 40 (1977) through various formats to become Boise's premier classic rock destination under Cumulus Media ownership.",
  "fullContent": "KKGL 96.9 FM \"The Eagle\" represents nearly five decades of radio evolution in the Treasure Valley, transforming from a small-town Top 40 station to become \"Boise's Classic Rock Station\" and one of Idaho's most recognizable radio brands. Licensed to Nampa but serving the entire Boise metropolitan area from powerful transmitters in the Robie Creek tower farm, KKGL has weathered multiple format changes, call letter transitions, and ownership shifts while ultimately finding its identity as the region's premier destination for classic rock music.\n\nFrom its humble beginnings as KUUZ in February 1977 through its various incarnations as KBNY, KFML, and KLCI, the station's journey reflects the broader evolution of FM radio from automated programming to sophisticated, personality-driven broadcasting that serves distinct demographic segments. Under current Cumulus Media ownership, The Eagle has established itself as both a musical authority and cultural institution, featuring the nationally syndicated Bob & Tom Show alongside local personalities who understand the deep connection between classic rock music and the lifestyle values of their devoted audience.\n\nWith 48,000 watts of effective radiated power and a signal that covers a massive geographic area throughout Idaho and beyond, KKGL has proven that classic rock's appeal transcends generational boundaries while creating lasting emotional connections that sustain audience loyalty across decades. The station's success in balancing national programming resources with local community engagement demonstrates how heritage radio formats can thrive by honoring their musical legacy while adapting to contemporary audience expectations and technological advances.\n\nFROM KUUZ TOP 40 TO EARLY FORMAT EXPERIMENTATION\n\nKKGL's broadcasting history began in February 1977 when \"the station signed on the air\" with \"the original call sign KUUZ.\" The initial programming featured \"an automated Top 40 format\" that reflected the standard approach for new FM stations during the late 1970s expansion period.\n\nThe station's early operations were modest, as it \"was co-owned with 1340 KAIN with studios on 5th Street South in Nampa.\" This dual-frequency arrangement provided operational efficiency while serving both the Nampa community and the growing Boise metropolitan area with complementary programming approaches.\n\nThe automated Top 40 format represented typical programming for newly launched FM stations, utilizing satellite programming or automation systems that required minimal local staffing while providing contemporary music programming. This approach allowed new stations to establish audience awareness while building operational capacity for more sophisticated programming development.\n\nThe KUUZ era established the 96.9 frequency as a viable alternative to established Boise market stations, creating brand recognition and audience familiarity that would prove essential for subsequent format transitions and market expansion efforts.\n\nDuring this period, the station began developing the technical capabilities and market positioning that would eventually support its evolution into a major market competitor serving the broader Treasure Valley region.\n\nTHE KBNY TRANSITION AND MIDDLE-OF-THE-ROAD PROGRAMMING\n\n1982 marked the first significant format change when \"the station changed its call letters to KBNY and aired a middle-of-the-road (MOR) format.\" This strategic shift reflected recognition of demographic trends and the need to serve audience segments not adequately addressed by existing market competitors.\n\nThe middle-of-the-road format represented a significant departure from Top 40 programming, targeting older adult audiences with music programming that emphasized established artists and familiar songs rather than contemporary hits. This approach required different programming expertise and on-air talent capable of serving more sophisticated audience expectations.\n\n\"The station later switched to an adult contemporary format,\" demonstrating continued experimentation as management sought to identify the most effective programming approach for their market position and technical capabilities. This format evolution reflected the broader radio industry's movement toward demographic specialization during the 1980s.\n\nThe adult contemporary transition represented recognition that successful FM programming required clear demographic targeting and consistent format execution rather than broad-based programming that attempted to serve all audience segments simultaneously.\n\nThese early format experiments established important lessons about audience development and market positioning that would inform subsequent programming decisions and contribute to the station's eventual classic rock success.\n\nCALL LETTER CHANGES AND CONTINUED FORMAT DEVELOPMENT\n\n1986 brought another call letter change when \"the call sign was changed to KFML,\" followed quickly by yet another transition in 1987 when \"the call sign was changed to KLCI.\" These frequent call letter changes reflected ongoing ownership transitions and format experimentation as the station sought its optimal market position.\n\nBy 1989, \"the format was changed to oldies\" with branding as \"Boise's New...Rock 97,\" representing the station's first movement toward rock-based programming that would eventually define its character. This format change reflected the emerging viability of oldies programming as baby boomers aged and sought music from their youth.\n\n\"The format changed to adult contemporary by 1991,\" demonstrating continued uncertainty about optimal programming direction. However, this experimentation period provided valuable audience research and market intelligence that informed subsequent strategic decisions.\n\nThe multiple format changes during the late 1980s and early 1990s reflected broader industry trends as FM radio matured and stations sought sustainable competitive positions in increasingly crowded markets. Each format experiment contributed to understanding audience preferences and technical capabilities.\n\nThis period of experimentation, while potentially confusing for audiences, ultimately provided the station with comprehensive knowledge of various programming approaches and audience segments that would prove essential for successful classic rock programming development.\n\nTHE CLASSIC ROCK BREAKTHROUGH AS KLCI\n\n1993 marked the most significant programming development when \"KLCI switched to playing classic rock as 'Classic Rock 97'.\" This format change proved transformative, as it aligned the station with musical preferences of the core adult demographic while distinguishing it from contemporary rock competitors.\n\nThe \"Classic Rock 97\" branding positioned the station as the definitive source for classic rock music in the Treasure Valley, creating clear format identity that appealed to audiences seeking music from the 1960s, 1970s, and 1980s rather than contemporary offerings.\n\nBy the mid-1990s, \"KLCI rebranded as 'B96.9, Boise's Best Rock'\" with \"mostly classics and a few current adult-appeal titles.\" This programming evolution demonstrated growing confidence in the classic rock format while maintaining flexibility for occasional contemporary additions.\n\nThe B96.9 era proved successful enough to warrant continued investment in the classic rock format while refining the station's approach to serve audience preferences more effectively. The combination of classic rock foundation with selective contemporary additions created programming that satisfied both nostalgia and discovery impulses.\n\nThis period established classic rock as the station's core competency while building audience loyalty that would sustain the format through subsequent ownership changes and competitive challenges.\n\nTHE EAGLE BRAND ESTABLISHMENT AND CALL SIGN CHANGE\n\n1997 represented the most significant branding development when \"the station changed its name to '96.9 The Eagle', along with changing its call signs to KKGL.\" This transformation created the identity that has defined the station for nearly three decades.\n\nThe \"Eagle\" branding proved inspired, as it conveyed strength, freedom, and American identity that resonated perfectly with classic rock's cultural associations. The brand imagery connected classic rock music with lifestyle values that appealed to the format's core demographic.\n\nThe KKGL call letters were specifically chosen to reflect the \"Eagle\" brand identity, creating consistency between technical identification and marketing positioning that enhanced brand recognition and audience loyalty.\n\n1997 also marked the beginning of sustained format consistency that allowed The Eagle to build lasting audience relationships rather than constantly adapting to format changes. This stability proved essential for developing the deep audience loyalty that characterizes successful classic rock stations.\n\nThe Eagle brand establishment coincided with classic rock's maturation as a format, as the music of the 1960s, 1970s, and early 1980s achieved sufficient historical distance to be considered \"classic\" while maintaining emotional resonance for adult audiences.\n\nCUMULUS MEDIA OWNERSHIP AND PROFESSIONAL OPERATIONS\n\nKKGL currently operates under Cumulus Media ownership through \"Radio License Holding CBC, LLC,\" representing integration into one of America's largest radio broadcasting companies. This corporate structure provides resources for professional operations, national programming partnerships, and technical infrastructure that enhances competitive positioning.\n\nThe Cumulus ownership allows KKGL to benefit from clustering with sister stations KBOI, KBOI-FM, KIZN, KQFC, and KTIK, creating operational efficiencies and coordinated advertising sales strategies across different demographic targets. This clustering model enables shared resources while maintaining format distinctiveness.\n\n\"The studios and offices are on West Bannock Street in downtown Boise,\" centralizing operations while maintaining accessibility for community involvement and promotional activities. This location provides professional facilities while supporting the station's role as a significant Boise media institution.\n\nCorporate ownership provides access to national classic rock programming resources, including syndicated shows and promotional campaigns that independent operators cannot match. This support enhances programming quality while maintaining local identity and community connections.\n\nThe Cumulus structure also ensures technical support and equipment upgrades necessary for maintaining competitive audio quality and operational reliability that classic rock audiences expect from professional broadcasting operations.\n\nPROGRAMMING LINEUP AND NATIONAL SYNDICATION\n\nKKGL's programming schedule demonstrates sophisticated balance between national programming resources and local personality-driven content. The station \"carries the syndicated Bob and Tom Show from Indianapolis in morning drive time,\" providing professional morning entertainment that has achieved national recognition and audience loyalty.\n\nThe Bob & Tom Show represents premium syndicated programming that many classic rock stations cannot afford, giving KKGL competitive advantages in the crucial morning drive daypart. The show's humor, entertainment features, and rock music focus align perfectly with classic rock audience preferences.\n\nCurrent programming includes:\n\u2022 Monday - Friday: 12:00 AM - 6:00 AM (96.9 The Eagle overnight programming)\n\u2022 6:00 AM - 10:00 AM (The Bob & Tom Show)\n\u2022 10:00 AM - 2:00 PM (Ron O'Brian)\n\u2022 2:00 PM - 7:00 PM (Forrest)\n\u2022 7:00 PM - 12:00 AM (Steve Gorman Rocks)\n\nWeekend programming includes \"Best of the Bob & Tom Show\" on Saturday mornings, specialized shows like \"70s @ 7:00\" and \"Live in Concert\" features that provide deeper musical content for dedicated classic rock fans.\n\nSteve Gorman Rocks provides evening programming from the former Black Crowes drummer, offering insider music industry perspective that enhances the station's credibility and entertainment value for serious classic rock enthusiasts.\n\nLOCAL PERSONALITIES AND COMMUNITY CONNECTION\n\nKKGL maintains strong local programming elements that distinguish it from automated competitors. Ron O'Brian serves midday programming, bringing his background as \"KBOI's Eye In The Sky\" traffic reporter and extensive Treasure Valley experience to classic rock programming.\n\nForrest Smithkors handles afternoon drive programming and serves as Programming Director, reached at 208-429-5612 and [email protected]. His dual role ensures coordination between programming decisions and on-air execution while maintaining consistency with The Eagle's brand identity.\n\nLocal personalities provide community connection and event promotion that automated programming cannot match. The station's local staff participates in community events, concert promotions, and charitable activities that build audience loyalty beyond musical programming.\n\nCaity Denny serves as Promotions Director (208-363-8709, [email protected]), coordinating community involvement and event marketing that strengthens The Eagle's position as a cultural institution rather than merely a music service.\n\nThe balance between national syndicated programming and local personalities creates comprehensive programming that serves both entertainment and community information needs while maintaining professional broadcast standards throughout the day.\n\nTECHNICAL CAPABILITIES AND SIGNAL COVERAGE\n\nKKGL operates with impressive technical specifications that ensure comprehensive coverage throughout the region. The station broadcasts with \"an effective radiated power (ERP) of 48,000 watts\" from transmitter facilities \"off Shafer Butte Road in Robie Creek, amid the towers for other Boise-area FM and TV stations.\"\n\nThis powerful signal provides coverage that extends well beyond the immediate Boise metropolitan area, reaching throughout Idaho and into neighboring states. The extensive coverage creates opportunities for regional advertising and audience development that enhance commercial viability.\n\nThe Robie Creek transmitter location represents optimal positioning for signal propagation throughout the mountainous terrain of southern Idaho. The shared tower farm arrangement provides operational efficiency while ensuring reliable broadcast operations.\n\n\"The signal covers a large\" geographic area that includes rural communities throughout Idaho, creating audience potential that extends far beyond traditional metro area demographics. This extensive reach distinguishes KKGL from urban-focused competitors.\n\nTechnical capabilities support high-quality audio reproduction essential for classic rock programming, which often features complex musical arrangements and audiophile-quality recordings that require superior transmission and reception quality.\n\nMUSICAL PROGRAMMING AND PLAYLIST DEVELOPMENT\n\nKKGL's classic rock programming encompasses the core artists and songs that define the format while maintaining enough flexibility to serve diverse audience preferences within the classic rock spectrum. The playlist includes legendary acts like \"Van Halen, Aerosmith, Pink Floyd, Led Zeppelin, The Rolling Stones, ZZ Top, The Cars, AC/DC, Def Leppard, Boston, Bad Company, The Eagles, Rush, Tom Petty & The Heartbreakers, Foreigner, Lynyrd Skynyrd, The Steve Miller Band, Journey, Guns N' Roses, Creedence Clearwater Revival.\"\n\nThis comprehensive artist roster demonstrates the breadth and depth of classic rock programming while maintaining focus on proven audience favorites. The playlist balance ensures both familiarity and discovery while avoiding repetition that drives audiences away.\n\nProgramming philosophy emphasizes album tracks and deeper cuts alongside obvious hits, serving serious music enthusiasts while maintaining broad appeal for casual listeners. This approach distinguishes The Eagle from competitors that rely heavily on repetitive hit rotations.\n\nThe station's musical expertise includes knowledge of album releases, band histories, and musical connections that enhance programming credibility. This depth of knowledge creates value for audiences seeking both entertainment and musical education about classic rock's rich history.\n\nSpecial programming features like weekend concert broadcasts and artist spotlights provide additional value for dedicated classic rock fans while creating appointment listening opportunities that build audience loyalty and engagement.\n\nPROMOTIONAL ACTIVITIES AND COMMUNITY INVOLVEMENT\n\nKKGL has established extensive community involvement that extends far beyond traditional radio programming. The station's promotional activities include concert sponsorships, ticket giveaways, and event marketing that position The Eagle as the region's classic rock authority.\n\nThe station maintains active relationships with concert venues, promoters, and touring artists that create exclusive promotional opportunities and behind-the-scenes content. These industry connections provide access to interviews, concert recordings, and promotional materials that enhance programming value.\n\nCommunity involvement includes support for local charitable causes, particularly those aligned with classic rock demographic values such as veterans' organizations, music education programs, and community festivals. This involvement creates positive brand associations while demonstrating authentic community commitment.\n\nThe Eagle's promotional approach emphasizes authentic classic rock culture and lifestyle values rather than superficial marketing campaigns. This strategy builds lasting audience relationships based on shared musical and cultural interests.\n\nSocial media presence includes active Facebook engagement with 365,106 likes and 26,237 talking about this, demonstrating significant community interaction and brand awareness that extends beyond traditional broadcast metrics.\n\nMEMORABLE PROMOTIONAL EVENTS AND STATION HISTORY\n\nKKGL's promotional history includes both successful community engagement and memorable mishaps that have become part of local radio folklore. Most notably, \"On St. Patrick's Day 1993, the morning crew released hundreds of snakes into the town.\"\n\nThis infamous promotion was \"an attempt to promote the station with the holiday\" based on \"the idea to get the listening audience to 'drive out the snakes' in honor of St. Patrick.\" However, \"Unfortunately not enough people were tuned in that day,\" creating a promotional disaster that became legendary in local broadcasting history.\n\nWhile the snake promotion represents poor judgment, it demonstrates the station's willingness to attempt creative marketing that captures audience attention. The incident has become part of The Eagle's informal history and local radio legend, illustrating both the risks and potential rewards of aggressive promotional strategies.\n\nMore successful promotional activities include concert series, music festivals, and community events that align with classic rock culture while serving legitimate community interests. These events create positive associations while avoiding the pitfalls of ill-conceived publicity stunts.\n\nThe station's promotional evolution reflects growing sophistication in understanding audience preferences and community standards while maintaining the edgy attitude that classic rock audiences appreciate.\n\nDIGITAL PRESENCE AND TECHNOLOGICAL ADAPTATION\n\nKKGL has embraced digital technology while maintaining traditional radio's immediacy and community connection. The station provides comprehensive streaming capabilities through multiple platforms, ensuring audience access regardless of location or device preferences.\n\nThe Eagle maintains active social media presence across multiple platforms, providing concert information, artist news, and community updates that supplement traditional broadcast programming. This digital engagement creates additional touchpoints for audience interaction and brand reinforcement.\n\nMobile app availability ensures that The Eagle's programming reaches audiences beyond traditional radio coverage areas while providing enhanced features like concert calendars, artist information, and interactive capabilities that extend the listening experience.\n\nThe station's website (kkgl.com) provides comprehensive information about programming, community events, concert listings, and station contact information. The digital presence reinforces The Eagle's position as the region's classic rock authority while providing convenient audience access to station services.\n\nDigital integration includes social media promotion of concerts, artist interviews, and special programming that creates multimedia experiences extending beyond traditional radio boundaries. This approach recognizes changing media consumption patterns while preserving radio's unique strengths.\n\nAUDIENCE ENGAGEMENT AND LISTENER LOYALTY\n\nKKGL has developed exceptional audience loyalty that reflects both programming quality and community connection. The station's classic rock format creates emotional connections with listeners who grew up with the music and continue to find relevance in the artists and songs that defined their formative years.\n\nAudience engagement extends beyond passive listening to active participation in station events, social media interaction, and community activities sponsored by The Eagle. This involvement demonstrates the deep connection that successful radio stations can build with their audiences.\n\nThe station's programming approach recognizes that classic rock audiences seek both entertainment and cultural validation of their musical preferences and lifestyle values. This understanding creates programming that serves both immediate listening pleasure and longer-term audience satisfaction.\n\nListener loyalty is evidenced by sustained ratings performance and advertiser confidence in The Eagle's ability to reach engaged consumers. The station's demographic profile attracts advertisers seeking to reach adults with disposable income and established purchasing patterns.\n\nThe Eagle's success demonstrates that heritage formats like classic rock can thrive by honoring their musical legacy while adapting to contemporary audience expectations and technological developments. This balance creates sustainable competitive advantages that newer formats struggle to match.\n\nCOMPETITIVE POSITIONING AND MARKET DYNAMICS\n\nKKGL operates in a competitive radio market that includes various formats targeting different demographic segments. The station's classic rock format positions it uniquely within the market, serving audiences that may not be adequately addressed by contemporary rock, adult contemporary, or country competitors.\n\nThe Eagle's extensive signal coverage provides competitive advantages over urban-focused stations, reaching rural and suburban audiences throughout Idaho who may not be served by other classic rock options. This geographic advantage creates audience loyalty and advertiser interest in reaching dispersed demographics.\n\nCompetition includes both terrestrial radio stations and digital alternatives like satellite radio and streaming services. KKGL's local programming elements and community connection provide advantages that automated or distant competitors cannot match.\n\nThe station's Cumulus ownership provides resources for competitive programming and promotional activities while maintaining local identity that distinguishes it from corporate-automated competitors. This balance creates optimal positioning for sustained market success.\n\nClassic rock's established audience base provides stability that newer formats lack, while the format's broad appeal creates opportunities for audience growth as younger listeners discover classic rock's enduring musical quality and cultural relevance.\n\nFUTURE PROSPECTS AND FORMAT SUSTAINABILITY\n\nKKGL's future prospects appear strong based on classic rock's proven audience appeal and The Eagle's established market position. The format's broad musical scope provides flexibility for evolution while maintaining core identity that audiences expect.\n\nThe station's technical capabilities, experienced ownership, and established community presence provide foundations for continued success regardless of changing media landscapes. These assets create competitive advantages that newer competitors struggle to replicate.\n\nClassic rock's intergenerational appeal suggests format sustainability as younger audiences discover the musical quality and cultural significance of artists from the 1960s, 1970s, and 1980s. This ongoing discovery process creates opportunities for audience development beyond traditional demographic boundaries.\n\nThe Eagle's digital adaptation demonstrates understanding of changing media consumption patterns while preserving radio's unique community connection and immediacy. This balance positions the station for success across multiple platforms and audience preferences.\n\nKKGL's success story illustrates how heritage radio formats can thrive by combining respect for their musical legacy with contemporary programming techniques and community engagement. This approach creates lasting value for audiences, advertisers, and the broader community while ensuring format sustainability for future generations of classic rock enthusiasts."
}