{
  "callLetters": "KRVB",
  "frequency": "94.9 FM",
  "location": "Nampa/Boise, Idaho",
  "format": "Adult Album Alternative (AAA)",
  "stationName": "The River",
  "established": "1975",
  "synopsis": "KRVB 94.9 FM \"The River\" represents one of the most successful format evolutions in Boise radio history, transforming from a contemporary hit radio powerhouse to become the Treasure Valley's premier adult album alternative (AAA) destination.",
  "fullContent": "KRVB 94.9 FM, known as \"The River,\" represents one of the most successful format evolutions in Boise radio history, transforming from a contemporary hit radio powerhouse to become the Treasure Valley's premier adult album alternative (AAA) destination. Licensed to Nampa but serving the greater Boise metropolitan area, this Lotus Communications-owned station has undergone multiple format incarnations since its 1975 launch as KFXD-FM, evolving through the competitive Top 40 wars of the 1980s and 1990s before finding its defining identity as an AAA station.\n\nNamed as a reference to both the Boise and Snake Rivers that define the region's geography, \"The River\" has become synonymous with musical diversity and community engagement, featuring an eclectic mix ranging from Crosby, Stills & Nash to R.E.M., Bob Marley to Dave Matthews Band. Under the current \"River Mornings with Melissa and Kevin\" show featuring the recently reunited duo of Melissa Liebenthal and Kevin Murphy, the station continues its tradition of combining local personality-driven programming with carefully curated music that appeals to educated, affluent adults who value authenticity over commercial radio's typical demographic targeting.\n\nBroadcasting from studios at 5257 Fairview Avenue alongside other Lotus properties, KRVB stands as proof that alternative radio formats can thrive in mid-sized markets when they genuinely serve community needs and musical tastes underrepresented by mainstream commercial radio.\n\nSTATION HISTORY\n\nThe FM Simulcast Era (1975-1979)\n\nKRVB's story begins in 1975 when the station first signed on as KFXD-FM, initially serving as the FM simulcast of established AM powerhouse KFXD (then on 580 AM). This was a common practice in the early FM era, when many AM stations launched FM translators to expand their reach before FM developed its own distinct programming identity.\n\nDuring these early years, KFXD-FM carried the same programming as its AM counterpart, providing stereo capability for music programming while simulcasting news, talk, and other content. This simulcast arrangement allowed listeners to experience better audio quality through FM transmission while maintaining the established brand identity of KFXD.\n\nXD-FM 95 and the Transition to Top 40 (1979-1984)\n\nBy 1979, KFXD-FM had developed its own distinct identity as \"XD-FM 95,\" featuring a full-service Top 40 radio format combined with news and talk programming. This hybrid approach reflected the transitional nature of FM radio during this period, when stations were experimenting with format combinations to establish market position.\n\nThe station's programming during this era was syndicated through Drake-Chenault's XT-40 format, a professionally produced Top 40 service that provided smaller markets access to major-market quality programming. Drake-Chenault was renowned for creating tight, exciting radio formats that emphasized hit music and professional production values.\n\nXD-FM 95's programming mix included:\n\u2022 Contemporary hit music featuring the biggest pop, rock, and dance hits of the era\n\u2022 Local news and information serving Treasure Valley communities\n\u2022 Talk segments addressing local issues and community concerns\n\u2022 Professional production through the Drake-Chenault syndication service\n\nThis format positioned the station to compete with existing Boise music stations while establishing FM's superior audio quality as a competitive advantage.\n\nThe KF95 Era and Top 40 Wars (1984-1995)\n\nIn 1984, KFXD-FM underwent a significant rebranding to become \"KF95,\" launching a full-time Top 40 format designed to compete directly with the dominant contemporary hit radio stations in the Boise market. This change represented the station's commitment to music programming and marked the beginning of one of Boise radio's most competitive eras.\n\nThe Competitive Landscape\n\nKF95's primary competition came from several established CHR stations:\n\nMagic 92 (KBBK): The incumbent Top 40 leader that had established the format's viability in the Boise market.\n\n92 Kiss FM (KIYS): The rebranded version of Magic 92, continuing the contemporary hit radio tradition until it switched to country in 1990.\n\nMagic 93.1 (KZMG): A new CHR competitor that launched in 1991, creating a three-way battle for Top 40 supremacy in the market.\n\nBrand Identity and National Connections\n\nUpon launching KF95, the station adopted a sophisticated branding approach by sharing logo design and marketing materials with two other major-market stations:\n\u2022 FM102 (KSFM) in Sacramento, California\n\u2022 Z-93 (WZGC) in Atlanta, Georgia\n\nThis branding alliance provided KF95 with major-market production values and visual identity while maintaining local programming and community connection. The shared branding suggested professional management and gave the station credibility in competing against established local competitors.\n\nProgramming Evolution (1984-1993)\n\nKF95's programming during its CHR years featured:\n\u2022 Hit music rotation emphasizing current pop, rock, and dance hits\n\u2022 Local personalities providing community connection and entertainment\n\u2022 Contest and promotion programming designed to build listener loyalty\n\u2022 Community involvement through remote broadcasts and local event coverage\n\nThe station successfully competed in the heated Top 40 market until 1993, when changing musical tastes and market conditions led to a significant programming shift.\n\nThe Adult Contemporary Transition (1993-1995)\n\nIn 1993, recognizing the challenges of continuing in the increasingly fragmented CHR market, KF95 moved toward an Adult Contemporary direction while retaining \"The Legend, KF95\" branding. This format shift reflected the station's attempt to mature with its audience while differentiating from the younger-skewing Magic 93.1.\n\nThe Adult Contemporary format featured:\n\u2022 Broader musical palette including current hits and recurrent favorites\n\u2022 Less aggressive presentation compared to traditional CHR formatting\n\u2022 Appeal to working adults during key dayparts\n\u2022 Maintained local personality presence while evolving musical focus\n\nThe Mix 95 Era and AAA Discovery (1995-2000)\n\nIn 1995, the station underwent another significant rebranding to become \"Mix 95,\" coinciding with a dramatic format change that would define its future direction. This transition marked the station's evolution from mainstream Top 40 programming to adult album alternative (AAA), a format that would prove to be its most successful and enduring identity.\n\nThe AAA Format Development\n\nThe shift to adult album alternative represented a bold programming move for the Boise market. AAA format characteristics included:\n\nMusical Diversity: Unlike the narrow playlists of Top 40 or Adult Contemporary formats, AAA embraced a wide range of musical styles including:\n\u2022 Alternative rock from artists like R.E.M., Pearl Jam, and Radiohead\n\u2022 Folk and acoustic music featuring artists like Tracy Chapman and Indigo Girls\n\u2022 World music and reggae including Bob Marley and international artists\n\u2022 Classic rock deep cuts from established artists like The Beatles and Led Zeppelin\n\u2022 Contemporary singer-songwriters such as Alanis Morissette and Sarah McLachlan\n\nAlbum-Oriented Approach: Rather than focusing solely on radio singles, AAA programming drew from entire albums, introducing listeners to deeper catalog material and emerging artists not heard on mainstream radio.\n\nLocal Music Support: The format provided opportunities for local and regional musicians to receive airplay alongside established national acts.\n\nCultural Programming: AAA stations often featured longer-form content addressing arts, culture, and social issues beyond typical radio fare.\n\nThe \"Music Difference\" Positioning\n\nAt one point during the Mix 95 era, the station briefly restored the KF95 moniker while positioning itself as \"The Music Difference.\" This branding emphasized the station's commitment to musical variety and alternative programming compared to more formatted competitors.\n\nThis positioning strategy worked to:\n\u2022 Differentiate from mainstream formats by emphasizing musical authenticity\n\u2022 Appeal to educated listeners who sought alternatives to commercial radio\n\u2022 Build community among alternative music fans in the Treasure Valley\n\u2022 Establish credibility with local musicians and music industry professionals\n\nTechnical Changes and Call Letter Evolution (1998-2000)\n\nIn 1998, the station's call letters changed from KFXD-FM to KFXJ, reflecting the fact that it was no longer co-owned with KFXD-AM. This technical change marked the station's complete independence from its AM heritage and full commitment to its FM identity.\n\nThe call letter change coincided with continued format refinement as the station prepared for its final evolution into \"The River\" brand. Programming during this transition period maintained the AAA format while developing the community connections and musical philosophy that would define the station's future success.\n\nThe Birth of \"The River\" (2000)\n\nIn 2000, the station completed its transformation with a comprehensive rebranding as \"94.9 The River,\" accompanied by new call letters KRVB. This rebranding represented more than just a name change\u2014it embodied a complete commitment to the AAA format and community-focused programming that would define the station for the next quarter-century.\n\nThe River Brand Identity\n\nThe \"River\" name was strategically chosen to reflect:\n\nGeographic Connection: References to both the Boise River running through the heart of the metropolitan area and the Snake River that defines much of Idaho's landscape.\n\nFlow and Continuity: The metaphor of a river suggested the station's musical programming would flow naturally between genres and eras rather than being constrained by rigid format boundaries.\n\nCommunity Gathering Place: Rivers serve as community focal points, reflecting the station's commitment to serving as a gathering place for like-minded listeners.\n\nNatural and Organic: The river metaphor emphasized authenticity and natural progression rather than manufactured commercial radio approaches.\n\nInitial River Programming Philosophy\n\nThe newly christened River established programming principles that continue today:\n\nMusical Eclecticism: \"The fact that 94.9 the River is challenging to describe in a sentence (or a page, for that matter) is exactly what makes it appealing to an adult audience who prefers genuine diversity in music.\"\n\nCommunity Commitment: The station made \"a significant commitment to 'community,' building an enviable list of alliances and reaching an equally enviable audience in terms of education, income, and other qualitative measures.\"\n\nAuthenticity Focus: Emphasis on \"genuineness in everything else\" beyond just musical programming, extending to community involvement and on-air presentation.\n\nBroad Musical Palette: Programming spanning \"From CSN to R.E.M., Bob Marley to Dave Matthews,\" demonstrating the station's commitment to musical variety.\n\nPROGRAMMING EVOLUTION AND KEY PERSONALITIES\n\nThe Ken Bass Era (2003-2023)\n\nThe hiring of Ken Bass in October 2003 marked the beginning of The River's most stable and successful programming period. Bass, a Boise radio veteran since 1985, brought extensive local market knowledge and a deep understanding of the AAA format's community-oriented approach.\n\nKen Bass Background and Experience\n\nKen Bass's radio career in Boise spanned nearly four decades:\n\u2022 Market Entry (1985): Initial arrival in Boise radio market\n\u2022 Format Experience: Previous work at multiple Boise stations including 106.3 KCIX, 107.9 KXLT (Lite FM), and 670 KBOI\n\u2022 Community Integration: Deep involvement in local community events and causes\n\u2022 Programming Philosophy: Commitment to local content and community connection\n\nRiver Morning Show Development\n\nBass's morning show on The River evolved through several co-host partnerships:\n\nTim Johnstone Partnership: Early collaboration with Tim Johnstone (who later became The River's Program Director) established the show's community-focused approach.\n\nDeb Courson Collaboration: Deb Courson joined as morning co-host in 2016, bringing extensive news experience from her previous 18 years at KBOI, KIDO, KIZN, and KZMG where she served as News Director and morning co-host from 1985 to 2003. Courson also served as Managing Editor for Public News Service from 1999 to 2015.\n\nMelissa Dawn Partnership: In the show's final incarnation under Bass, he was paired with Melissa Dawn (Melissa Liebenthal), who would become his successor as morning host.\n\nProgramming Characteristics\n\nThe Ken Bass morning show featured:\n\u2022 Local community focus with extensive coverage of Treasure Valley events and issues\n\u2022 Musical discovery introducing listeners to new AAA artists and deep catalog material\n\u2022 Listener interaction through calls and community feedback\n\u2022 Charity and community service promotion of local causes and non-profit organizations\n\u2022 Cultural programming discussions of arts, literature, and local cultural events\n\nThe 2023 Transition and Melissa Dawn Era\n\nIn January 2023, Ken Bass was laid off from The River as part of corporate-wide budget cuts at Lotus Communications. After nearly 20 years as the station's morning host, Bass's departure marked the end of an era while opening opportunities for new programming directions.\n\nThe Corporate Restructuring\n\nBass's departure was part of broader changes at Lotus Communications affecting multiple stations:\n\u2022 Budget constraints affecting radio industry operations nationwide\n\u2022 Programming consolidation reducing staff across the company's properties\n\u2022 Format protection maintaining The River's AAA format while reducing operational costs\n\nBass handled the transition professionally, noting: \"Management was very regretful and sad that this was happening, but budgetary cuts are budgetary cuts. The radio biz is pretty tough these days. I understand.\"\n\nMelissa Dawn Solo Period\n\nFollowing Bass's departure, Melissa Dawn continued as solo morning host, maintaining The River's community focus and musical programming philosophy. Her background provided continuity:\n\nExtensive Local Experience: Melissa began her Treasure Valley career in 1991 at heritage rock station J-105, where she hosted \"Electric Lunch\" for several years.\n\nMulti-Market Experience: She worked on-air in Boise at several stations hosting morning shows, producing and anchoring news, and traffic. She also worked mornings and afternoons in Salt Lake City before returning to Boise in 2013.\n\nProfessional Recognition: She won Best Commercial in Comedy, Best News, and Best News Story Awards from the Idaho State Broadcaster's Association.\n\nAdditional Expertise: Melissa acquired her Master's of Science in Psychology and works as a freelance voice-over talent and part-time scenario actress at Idaho's Peace Officers Standards & Training (POST) Academy.\n\nThe Return of Kevin Murphy (2025)\n\nIn April 2025, The River announced a major programming change with the debut of \"River Mornings with Melissa and Kevin,\" reuniting Melissa Liebenthal with Kevin Murphy, her former partner from their successful run at 107.1 K-Hits from 2015 to 2022.\n\nThe Reunion Strategy\n\nThe decision to reunite Melissa and Kevin reflected several strategic considerations:\n\nProven Chemistry: The duo's previous success at K-Hits demonstrated their ability to connect with Treasure Valley audiences.\n\nCross-Format Appeal: Their ability to transition from classic hits to AAA programming while maintaining audience loyalty.\n\nCommunity Connection: Both personalities had deep roots in the Boise radio community and understanding of local issues.\n\nProgramming Stability: Providing consistent morning programming to rebuild The River's audience following format transitions.\n\nProgramming Philosophy\n\nGeneral Manager Nick Coe explained the reunification: \"Reuniting Melissa and Kevin is a win for Boise radio. Their chemistry is undeniable, and bringing that energy to mornings on The River feels like the right move at the right time.\"\n\nProgram Director Tim Johnstone added: \"Having been a fan of Kevin's work with Melissa as a morning show duo, I could not be more excited about him joining River Mornings here at the station. He is a consummate professional with a quick wit, intimate knowledge of our community, and The River's commitment to making a positive impact here in the Treasure Valley.\"\n\nCurrent Morning Show Approach\n\nThe current \"River Mornings with Melissa and Kevin\" features:\n\u2022 Musical Discovery: Introduction of new AAA artists alongside established favorites\n\u2022 Community Engagement: Coverage of local events, causes, and issues\n\u2022 Entertainment Value: The duo's established chemistry and humor\n\u2022 Local Business Support: Promotion of Treasure Valley businesses and events\n\u2022 Cultural Programming: Discussion of arts, music, and cultural activities\n\nOWNERSHIP HISTORY AND CORPORATE EVOLUTION\n\nJournal Communications Era\n\nKRVB's ownership under Journal Communications provided stability and resources for format development during the crucial AAA establishment period. Journal Communications, a Milwaukee-based media company, operated multiple radio and television properties across the United States, providing corporate support while maintaining local programming autonomy.\n\nThe Journal Communications ownership era coincided with The River's most significant format development and market positioning. The company's commitment to local programming and community service aligned with the AAA format's emphasis on authentic community connection.\n\nLotus Communications Acquisition\n\nThe transition to Lotus Communications ownership marked a new chapter in KRVB's corporate evolution. Lotus Communications, based in Los Angeles, operates radio stations in multiple western markets, bringing experience in diverse format management and market-specific programming strategies.\n\nUnder Lotus ownership, KRVB has maintained its AAA format commitment while adapting to changing industry conditions. The company's multi-market experience has provided resources for competitive programming while preserving The River's local identity and community focus.\n\nCorporate Strategy and Local Autonomy\n\nLotus Communications' approach to KRVB reflects broader industry trends toward corporate efficiency balanced with local programming relevance. The company has maintained The River's format distinctiveness while implementing operational efficiencies that support long-term viability.\n\nThe corporate structure provides:\n\u2022 Access to industry resources and programming expertise\n\u2022 Operational support for technical and administrative functions\n\u2022 Marketing and promotional capabilities beyond local market resources\n\u2022 Financial stability for long-term format development\n\nTECHNICAL OPERATIONS AND FACILITIES\n\nBroadcasting Infrastructure\n\nKRVB operates from comprehensive facilities that support both on-air programming and community engagement activities. The station's technical infrastructure ensures reliable signal coverage throughout the Treasure Valley while maintaining audio quality standards essential for AAA programming.\n\nStudio Operations\n\nThe River's studios at 5257 Fairview Avenue house multiple operational components:\n\u2022 On-air studios equipped for live programming and music presentation\n\u2022 Production facilities for commercial and promotional content creation\n\u2022 News and information gathering capabilities supporting community coverage\n\u2022 Digital integration systems for streaming and online content delivery\n\nThe studio complex is shared with other Lotus Communications properties, creating operational efficiencies while maintaining format-specific programming capabilities.\n\nSignal Coverage and Technical Specifications\n\nKRVB's 94.9 FM frequency provides comprehensive coverage throughout the Boise metropolitan area and surrounding regions. The station's technical specifications ensure reliable reception in urban, suburban, and rural areas throughout the Treasure Valley.\n\nCoverage areas include:\n\u2022 Primary coverage throughout Ada and Canyon counties\n\u2022 Secondary coverage extending to surrounding rural communities\n\u2022 Digital streaming capabilities expanding reach beyond traditional broadcast boundaries\n\u2022 Mobile and online access supporting changing listener consumption patterns\n\nCOMMUNITY ENGAGEMENT AND CULTURAL IMPACT\n\nLocal Music Support\n\nThe River has established itself as a crucial supporter of local and regional music, providing airplay opportunities for emerging artists alongside established national acts. This commitment extends beyond simple playlist inclusion to active promotion of local music events and artist development.\n\nLocal music support includes:\n\u2022 Regular airplay for regional artists and bands\n\u2022 Promotion of local concerts and music festivals\n\u2022 Artist interview and feature programming\n\u2022 Support for music education and youth programs\n\u2022 Collaboration with local venues and music organizations\n\nCultural Programming and Community Events\n\nKRVB's community involvement extends beyond music programming to include support for arts, culture, and social causes throughout the Treasure Valley. The station's cultural programming reflects the AAA format's broader approach to community engagement.\n\nCommunity activities include:\n\u2022 Arts festival sponsorships and promotional support\n\u2022 Charitable fundraising for local non-profit organizations\n\u2022 Educational programming addressing community issues\n\u2022 Environmental and sustainability initiatives\n\u2022 Cultural event coverage and promotion\n\nThe station's approach to community engagement reflects the AAA format's emphasis on authentic involvement rather than superficial promotional activities.\n\nCOMPETITIVE POSITIONING AND MARKET DYNAMICS\n\nFormat Competition\n\nKRVB operates in a competitive Boise radio market that includes multiple music formats targeting similar demographic segments. The station's AAA positioning creates both opportunities and challenges in attracting and maintaining audience loyalty.\n\nPrimary competitors include:\n\u2022 Adult Contemporary stations targeting similar age demographics\n\u2022 Classic Rock formats appealing to overlapping musical tastes\n\u2022 Alternative and Modern Rock stations serving younger alternative music fans\n\u2022 Public radio programming offering non-commercial alternative content\n\nThe River's competitive advantage lies in its unique combination of musical diversity, local programming, and community engagement that distinguishes it from more narrowly focused competitors.\n\nDemographic Positioning\n\nThe AAA format's appeal to educated, affluent adults creates attractive audience characteristics for advertisers while requiring sophisticated programming that serves diverse musical tastes and cultural interests.\n\nTarget audience characteristics include:\n\u2022 College-educated adults with disposable income\n\u2022 Cultural and artistic interests beyond mainstream entertainment\n\u2022 Environmental and social consciousness\n\u2022 Appreciation for musical authenticity and diversity\n\u2022 Active community involvement and local business support\n\nMarket Evolution and Adaptation\n\nKRVB has successfully adapted to changing media consumption patterns while maintaining its core AAA identity. The station's evolution reflects broader industry trends toward specialized programming that serves specific audience segments rather than attempting mass market appeal.\n\nAdaptation strategies include:\n\u2022 Digital platform integration expanding audience reach\n\u2022 Social media engagement enhancing community connection\n\u2022 Streaming capabilities serving mobile and online listeners\n\u2022 Event programming creating direct audience interaction\n\u2022 Flexible programming approaches responding to changing musical tastes\n\nREVENUE MODEL AND BUSINESS STRATEGY\n\nAdvertising and Sponsorship\n\nKRVB's revenue model emphasizes quality demographics over quantity, serving advertisers seeking educated, affluent consumers with specific lifestyle characteristics. The station's community involvement creates additional value for local businesses seeking authentic marketing partnerships.\n\nRevenue streams include:\n\u2022 Traditional commercial advertising during programming\n\u2022 Event sponsorships and promotional partnerships\n\u2022 Digital advertising through streaming and online platforms\n\u2022 Community event partnerships and promotional activities\n\u2022 Specialized programming sponsorships aligned with audience interests\n\nThe AAA format's demographic appeal supports premium advertising rates while requiring programming that maintains audience loyalty and engagement.\n\nCommunity Partnership Model\n\nThe River's approach to revenue generation emphasizes long-term community partnerships rather than transactional advertising relationships. This strategy creates sustainable business relationships while supporting the station's community engagement mission.\n\nPartnership benefits include:\n\u2022 Enhanced credibility through authentic community involvement\n\u2022 Cross-promotional opportunities extending marketing reach\n\u2022 Event collaboration creating additional revenue streams\n\u2022 Brand association with community values and cultural activities\n\u2022 Long-term client relationships supporting revenue stability\n\nDIGITAL INTEGRATION AND FUTURE ADAPTATION\n\nOnline Presence and Streaming\n\nKRVB has embraced digital technology while maintaining traditional radio's community connection and musical curation strengths. The station's online presence extends its reach beyond traditional broadcast boundaries while preserving the AAA format's distinctive characteristics.\n\nDigital capabilities include:\n\u2022 High-quality streaming through multiple platforms\n\u2022 Social media engagement supporting community connection\n\u2022 Online content extending on-air programming\n\u2022 Mobile applications providing enhanced listener features\n\u2022 Digital music integration supporting playlist discovery\n\nThe digital strategy recognizes changing media consumption patterns while preserving radio's unique strengths in community connection and musical discovery.\n\nTechnology and Programming Evolution\n\nThe River's adaptation to technological change reflects broader industry evolution toward multi-platform content delivery while maintaining format authenticity and community focus.\n\nTechnology integration includes:\n\u2022 Advanced audio processing ensuring broadcast quality\n\u2022 Digital automation supporting programming efficiency\n\u2022 Social media integration enhancing audience engagement\n\u2022 Streaming analytics providing audience insights\n\u2022 Mobile optimization serving changing consumption patterns\n\nCHALLENGES AND OPPORTUNITIES\n\nIndustry Challenges\n\nKRVB faces competitive challenges common to contemporary radio operations, including streaming service competition, changing media consumption habits, and economic pressures affecting advertising revenue.\n\nSpecific challenges include:\n\u2022 Competition from streaming services offering unlimited music selection\n\u2022 Demographic changes affecting traditional radio listening patterns\n\u2022 Economic pressures on local advertising markets\n\u2022 Corporate consolidation affecting operational resources\n\u2022 Technology costs associated with digital platform maintenance\n\nThe station's response emphasizes radio's unique strengths in community connection, local programming, and musical curation that distinguish broadcast radio from purely digital alternatives.\n\nFormat Opportunities\n\nThe AAA format's flexibility and community focus create opportunities for continued relevance despite changing media landscapes. The format's emphasis on musical discovery and cultural programming provides competitive advantages over automated alternatives.\n\nOpportunities include:\n\u2022 Musical diversity appealing to multiple demographic segments\n\u2022 Community engagement creating loyal audience relationships\n\u2022 Local programming providing unique value proposition\n\u2022 Cultural programming serving educated audience segments\n\u2022 Authentic brand positioning distinguishing from corporate competitors\n\nFUTURE PROSPECTS AND SUSTAINABILITY\n\nLong-term Viability\n\nKRVB's future prospects appear strong based on the AAA format's proven appeal and the station's established community position. The format's broad musical scope provides flexibility for evolution while maintaining core identity characteristics that audiences expect.\n\nSustainability factors include:\n\u2022 Established audience loyalty supporting long-term viability\n\u2022 Community partnerships providing revenue stability\n\u2022 Format flexibility allowing adaptation to changing musical tastes\n\u2022 Corporate resources supporting competitive programming\n\u2022 Digital integration expanding audience reach and engagement\n\nThe station's success demonstrates how specialized radio formats can thrive by serving specific audience needs while maintaining authentic community connections.\n\nEvolution and Adaptation\n\nThe River's continued evolution reflects successful adaptation to changing industry conditions while preserving essential format characteristics that distinguish AAA programming from mainstream alternatives.\n\nFuture development areas include:\n\u2022 Enhanced digital integration expanding audience access\n\u2022 Community partnership expansion creating additional revenue streams\n\u2022 Programming innovation maintaining format freshness\n\u2022 Technology adoption improving operational efficiency\n\u2022 Audience development strategies serving changing demographics\n\nCONCLUSION\n\nKRVB 94.9 FM \"The River\" represents a successful example of radio format evolution and community engagement in a mid-sized market. The station's transformation from Top 40 powerhouse to AAA destination illustrates how radio stations can successfully reinvent themselves by identifying and serving underrepresented audience segments.\n\nThe River's success stems from its commitment to musical diversity, community engagement, and authentic programming that serves educated, culturally aware adults seeking alternatives to mainstream commercial radio. The station's evolution through multiple format changes demonstrates the importance of market research, community understanding, and programming flexibility in achieving long-term success.\n\nUnder current ownership and programming leadership, KRVB continues to evolve while maintaining the core AAA characteristics that have defined its success. The recent reunification of Melissa Liebenthal and Kevin Murphy as morning hosts represents strategic programming that combines proven audience appeal with format authenticity.\n\nThe station's future prospects remain strong based on the AAA format's continued relevance, established community relationships, and successful adaptation to changing media consumption patterns. KRVB stands as proof that alternative radio formats can thrive when they genuinely serve community needs and provide programming unavailable through mainstream commercial alternatives.\n\nThe River's story illustrates the enduring value of local radio when executed with strategic vision, community commitment, and authentic programming that serves specific audience needs while adapting to changing industry conditions. As the station continues its evolution, it maintains the essential characteristics that have made it a distinctive voice in Treasure Valley broadcasting and a model for successful AAA programming in mid-sized markets."
}