{
  "callLetters": "KTHI",
  "frequency": "107.1 FM",
  "location": "Caldwell/Boise, Idaho",
  "format": "Country",
  "stationName": "107.1 Hank FM",
  "established": "1983",
  "synopsis": "KTHI 107.1 FM represents a fascinating case study in format evolution and market adaptability within the Boise radio landscape, currently operating as \"107.1 Hank FM\" with Idaho's Real Country format.",
  "fullContent": "KTHI 107.1 FM represents a fascinating case study in format evolution and market adaptability within the Boise radio landscape, currently operating as \"107.1 Hank FM\" with Idaho's Real Country format. Licensed to Caldwell but serving the greater Boise metropolitan area, KTHI has undergone significant transformations throughout its operational history, evolving from its original identity through various format experiments before settling into its current successful country music positioning. The station's journey reflects broader trends in radio broadcasting, including market consolidation, format specialization, and the ongoing challenge of serving diverse audience segments within competitive metropolitan markets. Under its current \"Hank FM\" branding, KTHI has established itself as a distinctive voice in the Treasure Valley's country music landscape, differentiating itself from competitors through carefully curated music selection, local personality programming, and community engagement initiatives that reflect both traditional country values and contemporary musical trends.\n\nSTATION HISTORY AND DEVELOPMENT\n\nEarly Establishment and Original Operations\n\nKTHI's broadcasting history began during a period of significant expansion in FM radio development, when the Federal Communications Commission was actively encouraging the establishment of new FM stations to provide programming alternatives and serve specialized audience needs. The station's original establishment reflected the growing recognition that FM's superior audio quality made it particularly suitable for music programming and that the expanding FM spectrum could accommodate more diverse programming approaches than the crowded AM band.\n\nInitial Technical Parameters:\n\u2022 FM frequency allocation at 107.1 MHz providing high-quality stereo audio capability\n\u2022 Transmitter location in Caldwell with coverage extending throughout the Treasure Valley\n\u2022 Power levels designed to serve the Boise metropolitan area effectively while maintaining signal quality\n\u2022 Antenna configuration optimized for the region's varied topography and urban development patterns\n\nEarly Programming Development:\n\u2022 Music-focused programming taking advantage of FM's superior audio reproduction capabilities\n\u2022 Format selection designed to serve audience segments not adequately addressed by existing Boise area stations\n\u2022 Community service programming fulfilling FCC requirements while building local listener connections\n\u2022 Technical quality emphasis distinguishing FM programming from AM alternatives in the market\n\nMarket Entry and Competitive Environment\n\nKTHI entered a radio market that was experiencing rapid growth and increasing sophistication:\n\nMarket Conditions at Launch:\n\u2022 Boise's expanding metropolitan population creating opportunities for specialized programming approaches\n\u2022 Limited FM competition in certain format categories allowing new stations to establish distinct market positions\n\u2022 Growing advertiser recognition of FM radio's effectiveness in reaching desirable demographic segments\n\u2022 Technological improvements making FM receivers more affordable and widely available to consumers\n\nInitial Format Strategy:\n\u2022 Music programming emphasizing genres that benefited from FM's audio quality advantages over AM transmission\n\u2022 Target audience development focusing on demographics underserved by existing Boise area radio stations\n\u2022 Programming schedule structure balancing music content with information and community service elements\n\u2022 Local programming integration building connections with Treasure Valley communities and businesses\n\nFormat Evolution and Programming Experimentation\n\nThroughout its operational history, KTHI has undergone several significant format changes reflecting both market opportunities and changing listener preferences:\n\nEarly Format Periods:\n\u2022 Contemporary music programming serving demographics attracted to FM's superior audio quality\n\u2022 Adult contemporary positioning targeting mature audiences seeking sophisticated music programming\n\u2022 Rock format experimentation during periods when that genre showed growth potential in the market\n\u2022 Specialty programming serving niche audiences during specific dayparts or weekend periods\n\nProgramming Innovation and Adaptation:\n\u2022 Music format refinement responding to audience research and market feedback\n\u2022 Local programming development addressing community interests and regional cultural activities\n\u2022 Promotional strategy evolution building brand recognition and listener loyalty\n\u2022 Community involvement initiatives establishing the station as an active participant in regional activities\n\nThe Evolution to Country Format\n\nKTHI's transition to country music programming represented a strategic response to market research indicating strong potential for country format success in the Treasure Valley:\n\nCountry Format Adoption:\n\u2022 Market analysis revealing underserved country music audience in the Boise metropolitan area\n\u2022 Format positioning designed to differentiate KTHI from existing country stations through music selection and presentation style\n\u2022 Personality development featuring on-air talent with authentic connections to country music and rural lifestyle\n\u2022 Community engagement emphasizing values and activities associated with country music culture\n\n\"Hank FM\" Branding Development:\n\u2022 Brand identity creation reflecting both traditional country music heritage and contemporary country trends\n\u2022 Marketing strategy emphasizing authenticity and connection to Idaho's rural and agricultural heritage\n\u2022 Programming philosophy balancing classic country favorites with current hits and emerging artists\n\u2022 Community positioning establishing the station as a voice for country music fans throughout the region\n\nCurrent Operations as \"107.1 Hank FM\"\n\nProgramming Philosophy and Music Selection\n\nKTHI's current identity as \"107.1 Hank FM\" reflects a carefully developed approach to country music programming:\n\nMusic Programming Strategy:\n\u2022 \"Idaho's Real Country\" positioning emphasizing authentic country music rather than pop-country crossover material\n\u2022 Classic country integration featuring traditional artists and songs that define the genre's heritage\n\u2022 Contemporary country balance including current hits and emerging artists while maintaining format integrity\n\u2022 Local and regional artist support providing airplay opportunities for Idaho and regional country musicians\n\nProgramming Elements:\n\u2022 Morning show programming featuring local personalities with strong connections to country music and rural lifestyle\n\u2022 Music scheduling designed to provide familiar favorites while introducing listeners to new country artists\n\u2022 Community information integration including local event promotion and regional business support\n\u2022 Weather and traffic information tailored to the needs of rural and suburban listeners throughout the coverage area\n\nTarget Audience and Market Position\n\nKTHI serves specific demographic and psychographic segments within the competitive Boise radio market:\n\nPrimary Audience Characteristics:\n\u2022 Country music enthusiasts who prefer traditional and authentic country programming over pop-country alternatives\n\u2022 Rural and suburban residents whose lifestyle and values align with country music culture and themes\n\u2022 Demographics seeking programming that reflects Idaho's agricultural heritage and outdoor recreation opportunities\n\u2022 Listeners who value local programming and community connection over automated or syndicated content\n\nMarket Positioning Strategy:\n\u2022 Differentiation from competitors through music selection emphasizing \"real country\" rather than mainstream country-pop\n\u2022 Community integration ensuring programming reflects local interests, events, and cultural activities\n\u2022 Authenticity emphasis maintaining credibility with country music fans who value genuine rather than manufactured programming\n\u2022 Regional identity promotion celebrating Idaho's unique cultural characteristics and lifestyle advantages\n\nTechnical Operations and Broadcast Quality\n\nKTHI maintains technical standards designed to provide superior audio quality and reliable service throughout its coverage area:\n\nTransmission Specifications:\n\u2022 107.1 FM frequency providing high-quality stereo audio reproduction ideal for music programming\n\u2022 Power levels ensuring adequate coverage throughout the Treasure Valley while maintaining signal quality\n\u2022 Signal monitoring systems maintaining consistent audio standards and preventing technical problems\n\u2022 Backup systems ensuring continued operation during equipment failures or emergency situations\n\nProduction Capabilities:\n\u2022 Digital audio systems supporting both live and recorded programming with professional quality standards\n\u2022 Multi-track production facilities enabling sophisticated local content creation and commercial production\n\u2022 Remote broadcasting equipment supporting live coverage of community events and promotional activities\n\u2022 Internet streaming infrastructure extending reach beyond terrestrial coverage to online audiences\n\nCOMMUNITY ENGAGEMENT AND LOCAL PROGRAMMING\n\nCommunity Connection and Regional Identity\n\nKTHI demonstrates its commitment to serving the Treasure Valley through various local programming and community service initiatives:\n\nLocal Programming Elements:\n\u2022 Community event promotion supporting regional festivals, fairs, and cultural activities\n\u2022 Local business advertising and promotion supporting regional economic development\n\u2022 Agricultural information and weather services addressing the needs of rural listeners and farming communities\n\u2022 High school sports coverage connecting the station with local communities and building listener loyalty\n\nCultural Programming:\n\u2022 Idaho heritage programming celebrating the state's history, culture, and unique characteristics\n\u2022 Outdoor recreation information supporting hunting, fishing, camping, and other activities popular among country music fans\n\u2022 Local artist promotion providing airplay and promotional opportunities for regional country musicians\n\u2022 Community leader interviews addressing local issues and promoting civic engagement\n\nPublic Service and Emergency Broadcasting\n\nKTHI fulfills important public service functions beyond entertainment programming:\n\nEmergency Services:\n\u2022 Emergency Alert System participation providing critical information during natural disasters and emergencies\n\u2022 Severe weather monitoring and reporting protecting listener safety during storms and hazardous conditions\n\u2022 Community resource information connecting residents with essential services and assistance programs\n\u2022 Public health information supporting community wellness and safety initiatives\n\nCivic Engagement:\n\u2022 Election coverage providing information about local candidates and ballot issues\n\u2022 Government meeting coverage when appropriate, ensuring transparency and public access to local decision-making\n\u2022 Public service announcement broadcasting supporting non-profit organizations and community service initiatives\n\u2022 Community forum programming allowing residents to discuss local issues and concerns\n\nECONOMIC MODEL AND MARKET PERFORMANCE\n\nRevenue Generation and Financial Structure\n\nKTHI operates under a commercial broadcasting model that balances revenue generation with community service and programming quality:\n\nAdvertising Revenue:\n\u2022 Local business advertising supporting regional economic development while generating station revenue\n\u2022 Agricultural and rural business advertising serving the station's core audience while supporting regional industries\n\u2022 Automotive and recreational vehicle advertising targeting country music fans' lifestyle interests and purchasing patterns\n\u2022 National advertising providing additional revenue streams while maintaining local programming focus\n\nPromotional Activities:\n\u2022 Community event sponsorship building brand recognition while supporting regional activities\n\u2022 Concert and festival promotion connecting the station with country music events and artist appearances\n\u2022 Listener appreciation events building audience loyalty while creating promotional opportunities\n\u2022 Business partnership development creating mutual benefit relationships with regional companies\n\nMarket Performance and Competitive Position\n\nKTHI maintains its market position through strategic differentiation and authentic country programming:\n\nCompetitive Advantages:\n\u2022 Authentic country music programming serving listeners who prefer traditional country over pop-country alternatives\n\u2022 Local programming and community connection building listener loyalty through regional relevance\n\u2022 \"Idaho's Real Country\" positioning differentiating the station from competitors with more generic country formats\n\u2022 Consistent programming philosophy maintaining audience expectations while allowing for format evolution\n\nStrategic Planning:\n\u2022 Audience research informing music selection and programming decisions\n\u2022 Community feedback integration ensuring programming remains relevant to listener needs and interests\n\u2022 Technology adoption improving service quality while maintaining cost effectiveness\n\u2022 Partnership development creating mutual support relationships with regional businesses and organizations\n\nFUTURE OUTLOOK AND STRATEGIC DIRECTION\n\nTechnology Integration and Digital Expansion\n\nKTHI continues to adapt to changing media consumption patterns while maintaining its core country music identity:\n\nDigital Platform Development:\n\u2022 Internet streaming expansion reaching country music fans beyond terrestrial coverage area\n\u2022 Social media integration building stronger connections with listeners and promoting community events\n\u2022 Mobile accessibility ensuring programming availability across smartphones and other portable devices\n\u2022 On-demand content development supplementing live programming with archived shows and special features\n\nInteractive Programming:\n\u2022 Listener participation opportunities encouraging audience engagement and community building\n\u2022 Real-time communication enabling immediate response to audience requests and feedback\n\u2022 Community event integration connecting broadcast programming with local activities and celebrations\n\u2022 Contest and promotional activities building audience engagement while supporting local businesses\n\nCommunity Partnership and Service Expansion\n\nKTHI's future development emphasizes strengthened community connections and expanded local service:\n\nPartnership Development:\n\u2022 Agricultural organization cooperation supporting farming communities and rural economic development\n\u2022 Cultural institution collaboration promoting regional arts, heritage, and educational activities\n\u2022 Non-profit organization support providing promotional platforms for community service and charitable activities\n\u2022 Local government partnership enhancing civic engagement and community information services\n\nService Enhancement:\n\u2022 Programming diversity expansion serving broader community interests while maintaining country music core\n\u2022 Community event coverage increasing local relevance and building stronger listener connections\n\u2022 Educational content development addressing topics relevant to rural and suburban audiences\n\u2022 Public service expansion fulfilling broader community information and emergency communication needs\n\nKTHI 107.1 FM's evolution to \"Hank FM\" with \"Idaho's Real Country\" programming demonstrates the station's successful adaptation to market opportunities while maintaining authentic connections to country music culture and regional identity. Through its commitment to genuine country programming, community service, and local engagement, the station has established a distinctive position in the competitive Boise radio market.\n\nThe station's success illustrates how format specialization and authentic programming can create sustainable competitive advantages in metropolitan radio markets. KTHI's emphasis on \"real country\" rather than pop-country programming serves listeners who value traditional country music while building advertiser relationships with businesses that want to reach this specific audience segment.\n\nLooking toward the future, KTHI's integration of traditional country radio programming with digital technologies and enhanced community engagement positions the station well for continued growth and market success. The station's commitment to serving Idaho's country music fans while adapting to changing technology and media consumption patterns ensures its continued relevance as a distinctive voice in the Treasure Valley's radio landscape."
}